title,text,subject,date,label
沙特阿拉伯希望美国不会承认耶路撒冷是以色列的首都,"利雅得（路透社）- 据沙特官方新闻机构SPA周二报道，沙特阿拉伯表示希望美国不会承认耶路撒冷是以色列的首都，并警告称这一决定将产生严重后果。SPA援引沙特外交部一位未具名的官员消息来源说，这种认可将产生非常严重的后果，并将刺激所有穆斯林的感受。声明补充说，美国政府应该考虑到这样做的负面影响，王国不希望做出这样的决定，因为这会影响美国继续努力寻求公正解决巴勒斯坦问题的能力。

周一，沙特驻华盛顿大使哈利德·本·萨曼王子表示，在以色列和巴勒斯坦冲突最终解决之前，任何有关耶路撒冷的美国宣布都将损害和平进程并加剧地区紧张局势。哈利德王子在一项声明中说：“王国的政策一直是并且仍然是支持巴勒斯坦人民的，这一点已经向美国政府传达。”

美国总统唐纳德·特朗普正在权衡是否要承认耶路撒冷是以色列首都，但尚未作出决定，他的女婿兼中东和平特使贾里德·库什纳周日表示。上周一位高级政府官员表示，特朗普可能在周三就此事发表公告。以色列认为整个耶路撒冷都是其首都。巴勒斯坦人希望该市的东部部分成为未来国家的首都。几十年来，美国的政策一直是对双方的主张暂不作判断，直到以色列和巴勒斯坦冲突得到解决的协议中确定耶路撒冷的地位。",worldnews,"December 5, 2017 ",1
土耳其拘留了与黄金交易商扎拉布有关的17人：机构,伊斯坦布尔（路透社）——土耳其警方因涉及与美国检方合作的黄金交易商Reza Zarrab的调查拘留了17人，土耳其国营新闻机构Anadolu通讯社周二报道说。Anadolu报道称，警方怀疑Zarrab的三名员工向美国检察官提供了Fethullah Gülen穆斯林教士网络的文件。安卡拉表示，美国检察官是根据Gülen追随者伪造的文件提出诉讼的，这些追随者也被指责策划去年土耳其未遂政变。Zarrab是一名土耳其和伊朗国籍的人，他认罪称自己密谋帮助伊朗逃避美国制裁，并作为证人对一名土耳其国有银行高管就相关指控出庭作证。该高管否认有罪，并表示银行的每一笔交易都符合国际法规。这起案件加剧了美国与土耳其的关系紧张，两国都是北约军事联盟成员国。它激怒了总统雷杰普·塔伊普·埃尔多安，他将审判视为试图削弱土耳其及其经济。“在起诉书中存在阴谋指控是正确的，但这是针对土耳其而不是美国的阴谋，”埃尔多安告诉议会中的执政党正义与发展党成员。“这场审判是一场国际政变企图，其中心是FETÖ”，他说，使用了土耳其政府用来指代Gülen网络的说法。自1999年以来一直居住在美国的居伦否认参与政变，并谴责军事干预。Anadolu报道称，警方搜查了三名员工的住所，发现了电子版的文件。它表示，另外14人也因为调查而被拘留。伊斯坦布尔警察总部的相关人员暂时尚无回应。上周，伊斯坦布尔检察官办公室决定没收Zarrab及其熟人的资产作为调查的一部分，Anadolu报道说。,worldnews,"December 5, 2017 ",1
巴士炸弹在叙利亚霍姆斯市造成八人死亡：官方媒体,BEIRUT（路透社）——据叙利亚国家媒体报道，当地时间周二，在叙利亚霍姆斯市的一辆公共汽车上发生了一起炸弹爆炸事件，造成8人死亡、16人受伤。极端组织“伊斯兰国”宣称对此次袭击负责，其官方新闻机构AMAG表示，爆炸造成了11名叙利亚军队成员死亡。霍姆斯省省长塔拉勒·巴拉齐告诉国家电视台伊克巴尔里亚电视台，许多乘客都是大学生。这起爆炸发生在政府控制的霍姆斯市的Akrama区，靠近巴阿萨大学。视频显示人们聚集在一辆烧毁的车辆周围，该车辆位于街道中央。国家电视台称，“恐怖分子在公共汽车上放置的炸弹爆炸了”。极端组织“伊斯兰国”去年5月也声称对霍姆斯的一次类似袭击负责，当时一辆汽车炸弹炸死了4人，另有32人受伤。“今年，一系列爆炸袭击了叙利亚受政府控制的城市，包括首都大马士革。”霍姆斯警察局长在伊克巴尔里亚电视台上说：“安全部门一直在追捕潜伏细胞。”巴拉齐说，国家的敌人正在试图破坏稳定，因为胜利的阶段即将到来。霍姆斯市自冲突爆发以来首次完全回到政府的控制之下。在大马士革政府和伊朗支持的民兵的帮助下，叙利亚军队已经向西部叙利亚的反叛派别发起了反击，巩固了对主要城市中心的统治。随后，军队和盟军在今年向东推进，对抗“伊斯兰国”武装分子。美国对叙利亚和俄罗斯的攻击表示担忧。美国国务院周二强烈谴责了本周由叙利亚和俄罗斯飞机实施的袭击。这些飞机周日袭击了被围困的反对派飞地东部古塔拥挤的住宅区，至少有27人丧生。援助工作者和战争观察员说。美国国务院发言人希瑟·诺特说：“我们认为故意切断叙利亚平民（包括妇女和孩子）、阻止人道主义和医疗援助、轰炸医院、医务人员和第一响应者的手段是极其令人不安的。”她敦促俄罗斯履行其在东部古塔维持降级区的义务。,worldnews,"December 5, 2017 ",1
前埃及内政部长哈比卜·阿德利被捕：安全部门消息来源,"开罗（路透社）——前埃及内政部长哈比卜·阿德利因未能出庭接受腐败指控的宣判而被捕，两名安全部门消息人士周二表示。曾效力于被罢黜的埃及总统胡斯尼·穆巴拉克之下的阿德利本应在四月份出席最终听证会并向当局自首，但他并未出现并自那时起失踪。路透社获得的四月判决副本显示，阿德利和另外两名部官员被要求退还总计19.5亿埃及镑（1.0983亿美元）并处以同等金额的罚款。阿德利否认了这些指控，将于一月在埃及最高民事法院上诉法庭再次出庭。他的律师尚未立即联系上。埃及国家通讯社MENA早些时候报道称阿德利已被找到，但未透露其位置或是否被捕。

阿德利是埃及内部安全机构长期任职的高级官员，两年前他因其他贪污指控获无罪释放。2014年，他与穆巴拉克及其六名助手一起被裁定无罪，罪名与2011年导致他们倒台的大规模抗议活动有关。",worldnews,"December 5, 2017 ",1
芬兰怀疑俄罗斯飞机侵犯了领空,"赫尔辛基/莫斯科（路透社）——芬兰国防部星期二表示，它怀疑一架俄罗斯飞机在当天早些时候侵犯了波罗的海上空的芬兰领空。该部称，一架图波列夫TU-154，一架俄罗斯客机和运输机，在南部的波尔沃被检测到，边境警卫正在调查此事。一位发言人拒绝透露芬兰是否派遣战机识别这架飞机。俄罗斯国防部尚未对此作出回应。自2014年乌克兰危机爆发以来，芬兰指责莫斯科多次侵犯其领空。去年，爱沙尼亚和芬兰指责俄罗斯进入它们的领空，当时芬兰正在与美国签署防御协议。在另一起事件中，两架俄罗斯战斗机在波罗的海附近对美国导弹驱逐舰进行模拟攻击飞越。芬兰曾是俄罗斯帝国的一部分，并在1917年的俄国革命中获得独立，然后在第二次世界大战期间几乎失去了它，与苏联作战。现在它是欧盟成员国，不属于北约军事联盟。

",worldnews,"December 5, 2017 ",1
欧盟法院顾问称英国拒绝变性人养老金是错误的,"卢森堡（路透社）- 欧盟法院顾问周二表示，英国拒绝为一名变性女性申请国家养老金因其仍与其变性前的配偶结婚而提出的索赔是歧视性的。欧盟法院（ECJ）的倡导者米哈尔·鲍贝克在一份非约束性意见书中指出，婚姻状况对于异性恋者在获得国家退休金方面并不起作用。这构成了直接性别歧视，而这种歧视没有客观理由可以辩解，该意见书的新闻稿中提到。这份意见书发布在一个案例中，一位变性女性——她在出生时被登记为男孩，但自1991年以来一直以女性的身份生活，并在1995年进行了性别重置手术——在英国申请了国家退休金，当时她于2008年60岁。根据英国法律，出生于1950年4月6日之前的女性必须达到60岁才能获得国家退休金，而对于出生于1953年12月6日之前的男性来说，年龄则是65岁。她的申请被拒绝了，因为她没有申请完整的性别认同证书，原因是她仍然与一名女性结婚，而且她的婚姻在当时会被取消，因为同性婚姻在英国是不合法的。英国最高法院询问ECJ是否允许要求未婚才能承认性别变化，从而确定符合国家养老金的年龄的要求是根据欧盟法律。法院的新闻稿称，“倡导者得出结论认为存在不平等对待的情况，因为婚姻状况对异性恋者获得国家退休金不起任何作用，而已婚的变性人则受到要求撤销其婚姻的要求。”法院倾向于遵循倡导者的建议，但在大多数情况下并不是有义务这样做。倡导者强调，这不是一个关于同性婚姻的案件。成员国不必承认同性婚姻，他们仍然可以决定改变性别将在何种条件下得到法律认可。

",worldnews,"December 5, 2017 ",1
缅甸表示正在努力确保罗兴亚难民返回家园,日内瓦（路透社）- 缅甸周二向联合国表示，它正在与孟加拉国就成立联合工作组进行谈判，该工作组将在大约两个月内启动数十万罗兴亚难民安全自愿返回的过程。缅甸驻日内瓦联合国大使Htin Lynn在一个特别的人权理事会会议上说，他的政府愿意与国际合作伙伴一起工作，以确保流离失所者——他并未称之为罗兴亚人——能够实现“自愿、安全、体面和可持续的遣返和安置”。他还补充说，不会有难民营。,worldnews,"December 5, 2017 ",1
韩国、美国在朝鲜警告声中展开大规模空中演习,首尔（路透社）——韩国和美国官员表示，周一启动了大规模联合空中演习，一周前朝鲜宣布测试了其最先进的导弹，作为一项引发全球紧张局势的武器计划的一部分。美国和韩国年度演习“警戒王牌”（Vigilant Ace）将持续到周五，将有六架F-22猛禽隐形战斗机部署在参加演习的超过230架飞机中。朝鲜谴责这些演习是一种挑衅行为。根据一位驻韩美军空军发言人称，F-35战斗机也将加入演习，并将包括有史以来最大数量的第五代战斗机参与。大约12000名美国军人，包括海军陆战队和海军人员，将加入韩国军队。参加演习的飞机将从八个美韩军事基地起飞。据韩国媒体报道，B-1B枪骑兵轰炸机本周可能加入演习。美国空军发言人无法证实这一报道。美国军方在演习开始之前曾表示，这次联合演习旨在提高准备情况和作战能力，并确保半岛和平与安全。演习发生在朝鲜宣布测试其最先进的洲际弹道导弹后的一周，此举无视国际制裁和批评。平壤指责美国总统唐纳德·特朗普加剧了紧张局势，并在周末警告说，“警戒王牌”演习正在把朝鲜半岛的紧张局势推向爆发点，据朝鲜国家媒体报道。朝鲜和平统一委员会周日称特朗普“疯了”，并表示演习会把朝鲜半岛已经紧张的局势推向核战争的边缘。朝鲜国家通讯社朝中社周六援引外交部发言人说，特朗普政府通过在朝鲜半岛进行极其危险的核赌博而“乞求核战争”。朝鲜经常使用自己的国家媒体威胁美国及其盟友。,worldnews,"December 4, 2017 ",1
澳大利亚以担心中国为由，打击外国政治影响力。,悉尼（路透社）- 担心中国影响力日益增强的澳大利亚，周二宣布将禁止外国政治捐款作为打击外部势力干预国内政治的一部分措施。特恩布尔在堪培拉对记者说，外国势力正在对澳大利亚及世界政治进程进行前所未有的、越来越复杂的干预尝试。他提到了有关中国影响力的令人不安的报告。澳大利亚和新西兰是全世界大约三分之一允许向政党捐款的外国国家之一。在美国、英国和一些欧洲国家，此类捐赠是被禁止的。特恩布尔表示，澳大利亚的新法律部分参照了美国的《外国代理人登记法》，将对外部干涉行为定罪，并要求为各国工作的游说者进行注册。这一消息发布之际，人们担心北京可能正在扩大其影响力，而澳大利亚政客和中国政府利益之间的关系也变得越来越有争议性。费尔法克斯传媒和澳大利亚广播公司今年6月报道称，中国正集中精力渗透澳大利亚政治以推动自身利益。中国否认这些指控。在北京，外交部发言人耿爽说，中国无意干涉澳大利亚内政或利用政治资金影响它们。他还说：同时，我们再次敦促澳大利亚消除偏见，客观积极地评估中国及其与澳大利亚的关系。然而，上周一些高级工党职位的前任参议员萨姆·达斯蒂亚里辞职后，一段录音被曝光显示他似乎支持中国在南海有争议地区的扩张，这与他的党的立场相悖。这段录音显示他与一名主要的中国政治捐助人、房地产开发商黄翔茂站在一起，并被泄露给媒体。特恩布尔说：我和我的同事们都非常重视这些报道。但是，他说，新法律并不是针对某个国家的。他说：外国干涉是全球性问题……例如，我们都熟悉俄罗斯试图积极破坏美国选举的可信报告……威胁确实存在。如果通过议会，新的法律将禁止向任何在过去四年中花费超过100万澳元（76350美元）竞选的政治团体或政党捐款——这项规定也可能影响到环保和其他竞选团体。上个月，澳大利亚对柬埔寨打压民主团体的行动表达了深切关切。尽管如此，财政部长马修斯·科曼说，根据澳大利亚的新法律，外国捐助者将被禁止向非党派但直言不讳批评右翼政府的活动组织GetUp！捐款。GetUp！发表声明称，其海外捐款仅占0.5%。它批评拟议中的法律是为了避免审查政府政策，而没有限制跨国公司的捐款。根据新法律，叛国罪和间谍罪的界定也将包括拥有或接收敏感信息，而不仅仅是传播信息。自2015年把达尔文港出售给一家中国公司以来，由于该港口是澳大利亚最大的牛场和最大电网的所有权，因此政府对与中国这个最大贸易伙伴的联系一直感到非常紧张，阻止了中国利益收购澳大利亚最大的牧场和电力网。,worldnews,"December 5, 2017 ",1
德国人认为特朗普比朝鲜或俄罗斯更大的问题,BERLIN（路透社）——根据科伯基金会的一项调查，德国人认为美国总统唐纳德·特朗普对德国外交政策的挑战比朝鲜、俄罗斯或土耳其等独裁领导人更大。在对外政策关切方面，难民问题位居榜首，有26%的受访者担心德国应对涌入的寻求庇护者的能力。与特朗普和美国的关系排名第二，有19%的人将其描述为一个重大挑战，其次是土耳其占17%，朝鲜占10%，俄罗斯占8%。自今年1月进入白宫以来，特朗普通过退出巴黎气候协定、拒绝认证伊朗核计划的国际协议以及批评德国贸易顺差和对北约军事联盟的贡献，使德国感到不安。特朗普的行动促使通常谨慎的德国总理安格拉·默克尔在今年早些时候表示，柏林可能无法在未来依赖美国。她还敦促欧洲自己掌握自己的命运。在对1005名年满投票年龄的德国人进行的10月份的调查中，56%的德国人称与美国的关系不好或非常糟糕。尽管默克尔做出了承诺，但调查显示，公众对德国在国际危机中采取更积极角色的怀疑态度很深，有52%的受访者表示该国应该继续其战后的克制政策。这可能反映了最近选举活动中，默克尔及其主要对手几乎没有谈论如何回应特朗普总统带来的挑战和英国即将离开欧盟的情况。上周，默克尔保守派党派的成员诺伯特·罗特根（Norbert Rottgen）谴责了教育德国人增加国防和安全投资需求的领导力缺乏。,worldnews,"December 5, 2017 ",1
土耳其可能因耶路撒冷问题与以色列断交：埃尔多安,"安卡拉（路透社）——土耳其总统雷杰普·塔伊普·埃尔多安周二表示，如果美国正式承认耶路撒冷是以色列首都，土耳其可能会切断与以色列的外交关系，他称这一举动将是穆斯林的“红线”。美国官员表示，特朗普可能将于周三发表演讲单方面承认耶路撒冷是以色列的首都，这将违背几十年来美国的政策，并可能导致中东地区爆发暴力冲突。以色列在1967年的中东战争中占领了阿拉伯东耶路撒冷。后来它吞并了这个地区，宣布整个城市是其首都，但这一行动在国际上没有得到认可。巴勒斯坦人希望耶路撒冷成为他们未来国家的首都。“我很难过地听说美国准备承认耶路撒冷是以色列的首都，”埃尔多安在一个议会会议上说他的执政党正义与发展党（AKP）。 “特朗普先生，耶路撒冷是穆斯林的红线。当巴勒斯坦社会的伤口还在流血时，支持以色列的决定违反了国际法。”他说：“这可能会导致土耳其与以色列断绝外交关系。我警告美国不要采取这样的步骤，因为这将会加深该地区的问题。” 以色列政府发言人没有立即回应，但教育部长纳夫塔利·本内特（Naftali Bennett），总理本雅明·内塔尼亚胡联合政府的资深伙伴，对埃尔多安的评论不屑一顾。“总会有批评者，但最终，一个统一的耶路撒冷比埃尔多安的同情心要好得多，”他说。

",worldnews,"December 5, 2017 ",1
脱欧协议崩溃后，英国首相梅将与北爱尔兰政党会面,布鲁塞尔（路透社）- 首相特蕾莎·梅和其他英国官员将于周二与北爱尔兰民主统一党（DUP）进行会谈，此前欧盟就爱尔兰边境问题达成的一项脱欧初步协议在最后一刻被搁置。她位于伦敦白金汉宫10号的官方住所的一位官员表示，这位英国领导人最早可能于周三返回布鲁塞尔，试图挽救一项涉及接受爱尔兰岛上的监管协调以避免出现硬边界的协议，以便在脱离欧盟后进行有关未来贸易的谈判。,worldnews,"December 5, 2017 ",1
英国汉蒙德表示对达成脱欧谈判协议“非常有信心”,布鲁塞尔（路透社）——英国财政大臣菲利普·哈蒙德（Philip Hammond）周二表示，他对欧盟和英国在本周谈判中达成脱欧协议充满信心。“我们非常有信心能够推进这一进程，”哈蒙德在抵达欧盟财政部长会议时说。“讨论目前正在持续进行。”,worldnews,"December 5, 2017 ",1
埃尔多安表示，土耳其将摧毁与叙利亚库尔德武装有联系的人。,安卡拉（路透社）- 埃尔多安总统周二表示，土耳其将在不久的将来彻底摧毁叙利亚与库尔德武装有关联的人。土耳其对美国支持叙利亚库尔德YPG战士感到愤怒，这些战士主导了西方支持的军事行动，对抗伊斯兰国。安卡拉称，YPG是非法的库尔德工人党（PKK）的延伸。,worldnews,"December 5, 2017 ",1
"俄罗斯媒体称，俄方预计2018年美国的新制裁将进一步恶化两国关系。

（注：原句中“RIA”是俄罗斯新闻社的名字缩写，在翻译时需要保留。）",莫斯科（路透社）-俄罗斯新闻社援引俄罗斯外交部副部长谢尔盖·里亚布科夫的话说，由于美国可能对俄罗斯实施新的制裁，莫斯科预计在2018年初与美国的关系会出现新的复杂情况。里亚布科夫表示，华盛顿可能会在明年俄罗斯总统选举之前采取新的“破坏性冲动”，俄罗斯新闻社报道说。,worldnews,"December 5, 2017 ",1
新加坡部长称阻止激进主义在东盟的传播是优先事项,"新加坡（路透社）——新加坡外交部长周二表示，东南亚国家必须加强打击在该地区蔓延的宗教极端主义，包括缅甸动荡的若开邦。

部长维维安·巴拉克里希南说，中东伊斯兰国的削弱以及菲律宾南部马拉维镇最近被支持伊斯兰国武装分子占领，使人们重新担心该地区可能成为恐怖分子的磁铁。

我们在菲律宾南部看到一些回到马拉维的战斗人员，我们地区的其他地方还有潜在的恐怖主义温床，巴拉克里希南在一场关于新加坡作为东盟主席国优先事项的演讲中说。

“我们对若开邦的关注也与我们的担忧有关，即这会成为另一个避难所、另一个极端主义的温床，”他说。“这不仅是一种中东现象。

东盟包括印度尼西亚，它拥有世界上最大的穆斯林人口，主要是穆斯林的马来西亚和以佛教徒为主的缅甸，在那里对罗兴亚穆斯林少数族群的暴力行为引发了联合国种族清洗指控。缅甸否认了这些指控。尽管如此，印尼和马来西亚都对其境况施加压力，自去年八月以来，超过60万罗兴亚人逃离至孟加拉国。

新加坡已向因暴力而流离失所的人提供了人道主义援助。东盟成员国承诺加强合作和信息共享，以应对伊斯兰极端主义的威胁。

过去一年里，主要信奉基督教的菲律宾经历了该地区最严重的军事暴动，数百名持枪者，包括来自该地区其他地方的持枪者，占领了马拉维，引发该国二战后最严重的冲突。

印尼和马来西亚称数千名公民同情伊斯兰国，据信有数百人前往叙利亚加入该组织。印尼当局去年挫败了一起多民族新加坡袭击计划。

新加坡将于2018年担任由10个成员组成的东盟主席国。",worldnews,"December 5, 2017 ",1
阿拉伯联盟表示萨利赫之死可能导致也门“爆炸”：中东和北非新闻社,开罗（路透社）——阿拉伯国家联盟周二谴责了也门前总统阿里·阿卜杜拉·萨利赫被杀事件，称他的死亡可能会引发海湾国家的安全局势爆炸性升级，埃及MENA国家新闻机构报道说。阿拉伯国家联盟秘书处还谴责杀害萨利赫的胡塞运动是一个“恐怖组织”，要求国际社会将其视为恐怖组织。它表示，“必须采取一切手段来摆脱这个噩梦”，指的是胡塞武装。,worldnews,"December 5, 2017 ",1
基地组织高层领导人被击毙于阿富汗东部地区,喀布尔（路透社）——阿富汗情报局周二表示，在阿富汗军队、情报机构和北约领导的部队联合军事行动中，基地组织高级领导人奥马尔·凯塔布（Omar Khetab）与80人一同被杀。奥马尔·凯塔布也被称为奥马尔·曼苏尔（Omar Mansoor），是他在阿富汗分支中被杀害的最高级别成员。安全部队还在该行动中逮捕了27名个人，地点位于阿富汗东部省份加兹尼省、帕克蒂亚省和扎布尔省，机构没有进一步透露详情。,worldnews,"December 5, 2017 ",1
菲律宾总统杜特尔特命令警方在禁毒战中提供积极支持。,马尼拉（路透社）- 菲律宾总统罗德里戈·杜特尔特已下令警方积极支持他在毒品战争中的执法机构，他的发言人周二表示。被称为PDEA的毒品执法局将继续作为毒品战争的领导机构，但发言人Harry Roque表示，警方和其他机构应恢复对PDEA提供积极支持，并引用了杜特尔特签署的一份备忘录。杜特尔特在一月份暂停了警方的反毒行动，当时有人质疑警察的行为。,worldnews,"December 5, 2017 ",1
美国关注内部问题将改变世界秩序：德国,"柏林（路透社）——德国外交部长西格马尔·加布里埃尔（Sigmar Gabriel）周二表示，特朗普总统任期内美国在国际事务中的参与度降低将对德国及其欧洲邻国产生影响，并警告说世界秩序正在发生转变。加布里埃尔说，唐纳德·特朗普领导的美国的撤出加速了世界秩序的转变，这对德国和欧洲的利益产生了立即的影响。

以下是翻译后的内容：

BERLIN (路透社) - 特朗普总统领导下，美国在国际事务中的参与度降低将对德国及其欧洲邻国产生重大影响，德国外长西格马尔·加布里埃尔周二表示，他警告说世界秩序正在发生变化。加布里埃尔说，在唐纳德·特朗普领导下的美国退出其作为西方主导多边主义的可靠担保人的角色，加速了世界秩序的转变，对德国和欧洲的利益产生了立竿见影的影响。",worldnews,"December 5, 2017 ",1
