title,text,subject,date,label
俄罗斯防暴警察在圣彼得堡拘留反对派抗议者：路透社目击者,"圣彼得堡（路透社）- 据一位路透社目击者称，俄罗斯防暴警察星期六在圣彼得堡市中心拘留了至少10名反对派抗议者，当时数百名反克里姆林宫活动家正朝该市的主干道前进。

警方此前于周六拘捕了俄罗斯各地的超过100名反对派活动人士，他们参与了支持被监禁的反对派领袖阿列克谢·纳瓦尔尼的一系列抗议活动，以迎接三月份即将举行的总统选举。当局表示，大多数抗议活动未经事先官方批准，因此被视为非法。",worldnews,"October 7, 2017 ",1
"警方表示，对于伦敦博物馆事件是否与恐怖主义有关持开放态度。

（注：原文中“open mind”意为“开明的思想”、“开放的头脑”，在此处可译为“持开放态度”。）",伦敦（路透社）——伦敦警方表示，在汽车撞上自然历史博物馆外行人的事件发生后，他们持开放态度，这与他们之前称该事件与恐怖主义无关的说法相矛盾。伦敦警方的发言人说，反恐官员正在评估这一事件，但尚未就情况得出结论。早些时候，一名发言人告诉路透社，目前还没有将该事件视为与恐怖主义有关的事件。,worldnews,"October 7, 2017 ",1
默克尔、容克讨论加泰罗尼亚危机：欧盟官员,布鲁塞尔（路透社）——德国总理安格拉·默克尔和欧洲委员会主席让-克劳德·容克在电话中讨论了加泰罗尼亚危机，一位欧盟官员周六告诉路透社，这表明对潜在破坏整个欧洲的不安正在加剧。这一通话预示着对下周可能由加泰罗尼亚地区议会宣布独立以及西班牙政府的反应表示新的担忧，这可能加剧西班牙几十年来最严重的政治危机。周五，容克从印度与默克尔进行了交谈，当时他正在参加一次欧盟-印度的峰会。这位欧盟官员说，他们在其他事情上讨论了西班牙的情况，没有透露细节。关于这场危机对西班牙经济的影响以及对欧盟其他国家经济的潜在溢出效应，欧盟首都城市的关注日益增加。欧洲财政部长将于周一和周二在布鲁塞尔举行例会，可能会讨论这一问题，尽管它不在正式议程上。欧盟委员会多次敦促加泰罗尼亚和西班牙领导人找到政治解决方案。欧盟领导人在公开声明中对西班牙首相马里亚诺·拉霍伊的支持与他们对上周西班牙政府使用警察阻止加泰罗尼亚人投票进行独立公投的担忧相结合。周五，西班牙政府首次就上周使用暴力道歉。一些欧盟国家担心加泰罗尼亚独立的言论可能会在其他地区的欧洲引发分离主义情绪。,worldnews,"October 7, 2017 ",1
朝鲜准备远程导弹测试：俄罗斯议员称,"MOSCOW (Reuters) - North Korea is preparing to test a long-range missile which it believes can reach the west coast of the United States, a Russian lawmaker just returned from a visit to Pyongyang was quoted as saying on Friday. Anton Morozov, a member of the Russian lower house of parliament s international affairs committee, and two other Russian lawmakers visited Pyongyang on Oct. 2-6, Russia s RIA news agency reported.  They are preparing for new tests of a long-range missile. They even gave us mathematical calculations that they believe prove that their missile can hit the west coast of the United States,  RIA quoted Morozov as saying.  As far as we understand, they intend to launch one more long-range missile in the near future. And in general, their mood is rather belligerent.  Tensions have risen in recent weeks over North Korea s nuclear weapons and missile programs as Pyongyang has test-fired several missiles and conducted what it said was a test explosion of a hydrogen bomb as it advances toward its goal of developing a nuclear-tipped missile capable of hitting the U.S. mainland. Morozov s comments drove up the price of U.S. Treasury bonds, as investors, worried about the prospect of new North Korean missile tests, moved into assets the market views as a safe haven in times of uncertainty. Reuters was not able to independently verify Morozov s account, and he did not specify which North Korean officials had given him the information about the planned test. In Washington, a U.S. official said that there had been indications that North Korea could be preparing for a missile test on or around Oct. 10, the anniversary of the founding of the ruling Korean Workers Party and a day after the Columbus Day holiday in the United States. The official, speaking on condition of anonymity, did not disclose the type of missile that could be tested and cautioned that North Korea in the past has not staged launches despite indications that it would. A senior CIA analyst, speaking at a conference in Washington this week, said the North Korean government likely would stage some kind of provocation on Oct. 10 but did not elaborate on what form it might take.  There is a clarity of purpose in what (North Korean leader) Kim Jong Un is doing. I don t think he s done,  said Yong Suk Lee, the deputy assistant director of the CIA s Korea Mission Center, which was set up this year.  In fact, I told my own staff (that) October 10th is the Korean Workers Party founding day. That s Tuesday in North Korea, but Monday   the Columbus Day holiday - in the United States. So stand by your phones.  Morozov s delegation had  high-level  meetings in Pyongyang, RIA news agency said, citing the Russian embassy in the North Korean capital. Tensions over North Korea s nuclear program have been running high in recent weeks since Pyongyang staged a series of missile tests, and conducted a text explosion on Sept. 3 of what it said was a hydrogen bomb. There has also been an exchange of tough rhetoric between Pyongyang and Washington. U.S. President Donald Trump threatened to  totally destroy  North Korea if it threatens the United States. North Korean leader Kim Jong Un responded by calling Trump deranged and saying he would pay dearly for his threat. China, North Korea s main ally, has backed sanctions against Pyongyang and on Saturday in response to the Nobel Peace Prize being awarded to the International Campaign to Abolish Nuclear Weapons, said it backed a worldwide ban on nuclear weapons.  China has always supported a complete and total ban on nuclear weapons, but also believes that the goal of achieving nuclear disarmament cannot be achieved overnight and must advance gradually within the existing disarmament mechanism. China is willing to work with all parties to achieve a nuclear-weapon-free world,  said China s foreign ministry. Morozov is a member of the LDPR, a right-wing populist party. It casts itself as an opposition party, but hews close to the Kremlin line on matters of international affairs. Describing meetings with North Korean officials, Morozov said they  displayed serious determination and bellicose rhetoric,  RIA reported.  The situation, of course, demands the swiftest intervention of all interested states, particularly those represented in the region, in order to prevent wide-scale military action,  the agency quoted him as saying. Russia has closer relations with Pyongyang than many other world powers, linked in part to Kim Il Sung, the founder of North Korea and the current leader s grand-father, having lived for a time in the Soviet Union. Russian President Vladimir Putin has joined other world powers in condemning North Korea s weapons program, but has taken a softer line than Western governments. Putin has said that Pyongyang will not be cowed into giving up its weapons program. He has accused Washington of trying to effect regime change in North Korea, and predicted that would unleash chaos. U.S. Treasury prices surged on the report of a possible new missile test, pulling yields lower, as investors cut risk out of their portfolios and sought the safety of Treasuries. Treasury prices move inversely to their yields. Benchmark 10 year U.S. Treasury yields fell from the session high 2.40 percent mark US10YT=TWEB to 2.35 percent around midday (1600 GMT) in New York.  It has just been risk-off buying into the long (Columbus Day) weekend ... You look at the charts, it has really been a one-way trade of lower yields,  said Justin Lederer, Treasury analyst at Cantor Fitzgerald in New York. ",worldnews,"October 6, 2017 ",1
丹麦潜水员发现失踪瑞典记者的身体部位,"哥本哈根（路透社）——丹麦警方周六表示，潜水员在发明家自制的潜艇上神秘死亡的瑞典记者金·沃尔的头和腿被发现。彼得·马德森因杀害该瑞典记者被起诉，该记者于8月10日与他一起乘坐他的潜艇旅行后失踪。他否认了指控。马德森是一名丹麦人，在他制造的潜艇沉没后被救起。他的律师贝蒂娜·霍尔登·恩马克告诉路透社，她被告知了这一进展，但还没有收到任何材料或文件，拒绝进一步评论。警方后来确认，8月份冲刷到哥本哈根海岸的无头女性躯干是沃尔的，但没有确定死因。马德森说，沃尔是在他的潜艇内被沉重的舱盖击中而意外身亡的。周六，哥本哈根的一位警察发言人告诉记者，沃尔的颅骨没有骨折。周五，一些金属块压住的包里有一把刀和一些沃尔的衣服，在科格湾由协助警方的丹麦海军潜水员发现。警方发言人詹斯·莫勒·延森周六对记者说，这些身体部位将进一步调查以试图确定死亡原因。他说，马德森和他的律师们还没有时间对新证据作出反应。本周早些时候，一位警察检察官称，警官们在彼得·马德森运营的一个实验室中发现了一些图像，我们假定这些图像是真的，显示女人被窒息和斩首的画面。马德森说，警方搜查的电脑不是他的，而是实验室里的每个人都使用的。

",worldnews,"October 7, 2017 ",1
伦敦博物馆称外面发生严重事件，正在与警方合作,伦敦（路透社）——伦敦自然历史博物馆星期六表示，外面发生了一起严重事件，正在与警方合作。一位博物馆发言人告诉路透社，不允许任何人进入大楼，人们正通过另一个出口被放出来。,worldnews,"October 7, 2017 ",1
瑞士警方表示，持刀寻求庇护者被警察击毙,苏黎世（路透社）——瑞士警方在星期六射杀了一名来自斯里兰卡的38岁难民，因为他用刀攻击了两名寻求庇护者。执法部门官员说。瑞士意大利语区提契诺州的布里萨戈镇的警察说，他们在午夜后接到一个关于冲突的报告后被召到难民营。警官们说他们把两名寻求庇护者带进了大楼，在那里他们被一名挥舞着两把刀的男人袭击了。为了保障在场所有人的安全，一名州警察开枪击中了这名攻击者，导致他严重受伤，提契诺警方在一份声明中说。尽管进行了急救，但该男子在现场死亡，警方表示。,worldnews,"October 7, 2017 ",1
"土耳其部长表示将与德国改善关系

（注：由于原文中“will”是助动词，在英文中通常不直接翻译成中文中的“会”，而是根据上下文语境选择合适的表达方式。这里选择了“将与……改善关系”作为更符合中文语法的表达。）",柏林（路透社）- 土耳其外交部长梅尔维特·恰武什奥卢星期六表示，在北约盟友之间就一系列问题相互指责数月后，他将为与德国的关系正常化而努力。土耳其总统雷杰普·塔伊普·埃尔多安去年发动对反对派的打击后，已经紧张的关系变得更糟。德国还抗议拘留德国公民的政治指控，并提出了是否应该继续与土耳其进行欧盟入盟谈判的问题。卡武什奥卢以不寻常的和解语气告诉《明镜周刊》双周杂志，两国之间没有理由有问题。“如果你向我们迈出一步，我们将向你迈出两步，”他说道。“当被问及是否相信关系会恢复正常时，卡武什奥卢说：“是的。我愿意为此做出努力。”今年早些时候，埃尔多安和一些政治盟友把德国比作纳粹时代，因为一些地方当局阻止了土耳其部长们在这里竞选一项赋予总统广泛新权力的公投。德国官员引用了安全关切。卡武什奥卢说，纳粹的比较是对德国敌意的某种回应，补充说德国必须学会尊重土耳其。德国副外长迈克尔·罗思告诉《世界报》周日版，柏林准备会谈，并表示希望“我们很快能再次靠近”。然而，他表示，当无辜的德国人被关押时，德国不会保持沉默。“我们必须找到解决办法，”他说道。9月24日举行的选举中，保守派总理安格拉·默克尔赢得了第四个任期，但遭受了极右翼的重创。她似乎打算尝试与自由民主党（FDP）和绿党组成联合政府。一个可能的候任外交部长是Cem Özdemir，他是绿党的共同领导人，有土耳其血统，一直对埃尔多安持批评态度。卡武什奥卢告诉《明镜周刊》：“无论谁作为外交部长来到土耳其，都会得到同样的尊重，就像他对待我们一样。”,worldnews,"October 7, 2017 ",1
"美国驻沙特阿拉伯大使馆警告公民，在吉达未遂袭击事件未经证实报告后

请注意，由于我无法访问外部数据库或互联网资源，我无法确认该新闻的真实性。如果您需要有关此事件的最新信息，建议您查阅可靠的新闻来源或联系美国大使馆以获取更多信息。","利雅得（路透社）- 美国驻沙特阿拉伯大使馆警告美国公民在周六注意吉达和平宫周边地区的情况，因为社交媒体上有关于该地发生袭击的报告。

有数起未经证实的报告称，安全部队挫败了国王宫殿附近的袭击，导致袭击者和几名警卫死亡。 沙特政府尚未就此事发表官方声明。",worldnews,"October 7, 2017 ",1
波兰执政党和总统表示更接近就法院改革达成协议,华沙（路透社）- 波兰执政党PiS和总统安杰伊·杜达表示，他们更接近就改革司法体系达成妥协，这是一个曾一度亲密的政治盟友之间分裂的问题，也令欧盟感到担忧。7月，在2015年总统选举中由PiS支持当选的杜达总统意外否决了执政党的司法改革提案，这引发了全国抗议，并引起了波兰西方盟国对法院政治化的警告。这一否决引发了对PiS是否会履行对其下一届总统选举的支持的质疑。9月，总统提出了反提案，仍设想更大的政治控制权将掌握在总统手中，而不是由司法部长和国会行使。来自PiS和反对党派的两名立法者批评了总统的提议，但自那时起，杜达和PiS领导人雅罗斯瓦夫·卡钦斯基已经会面讨论改革，努力达成妥协。在最近一次于周五结束的会议后，双方代表均表示妥协即将到来。法西斯主义在司法改革方面做出了巨大的让步。（...）我认为我们接近达成协议，”一位PiS女发言人告诉广播电台。她补充说，PiS同意杜达提出的议会需要三分之二多数票才能任命新的大法官以及减少司法部长对法院的影响的建议。据国家通讯社PAP报道，杜达的首席助理Krzysztof Szczerski称与卡钦斯基的会面是“朝着实现共同、妥协版本的司法改革迈进的一步，该版本界定了总统最近提交给议会的法案的范围”。,worldnews,"October 7, 2017 ",1
马来西亚逮捕八人涉嫌恐怖主义关联,"吉隆坡（路透社）——马来西亚警方周六表示，该国逮捕了四名外国人和四名马来西亚人，他们涉嫌与阿布·赛亚夫、伊斯兰国和伊斯兰教徒联盟有关的恐怖活动。被捕的外国人中包括三名菲律宾人，其中一人是马来西亚永久居民，还有一名阿尔巴尼亚人。这些逮捕行动发生在沙巴州、雪兰莪州和霹雳州，时间从9月27日至10月6日。在婆罗洲的沙巴州有五名嫌疑人被逮捕，他们涉嫌协助阿布·赛亚夫激进分子渗透进入马来西亚。

警方称，被捕的阿尔巴尼亚人是当地一所公立大学的法律讲师，他与伊斯兰国有联系。另外两名被捕者曾因参与恐怖活动于2016年被判有罪。其中一人因涉嫌在监狱内招募囚犯并计划袭击穆斯林、基督教和印度教的宗教场所而被捕。该嫌疑人还据说掌握有关一名仍逍遥法外的塔齐姆基地组织马来西亚成员的信息，后者隶属于与伊斯兰教徒联盟有联系的团体。另一名被捕者是涉嫌招募了两名马来西亚人的同谋。

过去几年里，马来西亚已经逮捕了几百名疑似与激进团体有关联的人士。东南亚国家自2016年1月以来一直处于高度戒备状态，当时与伊斯兰国有关的自杀式炸弹袭击者和枪手在邻国印度尼西亚首都雅加达发动了一系列袭击。去年6月，在吉隆坡郊外的一家酒吧发生爆炸袭击事件，造成八人受伤。伊斯兰国宣称对上述袭击负责，这是首次在马来西亚本土发生的此类袭击事件。",worldnews,"October 7, 2017 ",1
埃尔多安表示土耳其支持FSA在伊德利卜的行动,"安卡拉（路透社）- 土耳其总统雷杰普·塔伊普·埃尔多安周六表示，土耳其士兵尚未进入叙利亚的伊德利卜，但自由叙利亚军正在执行该行动，据NTV新闻频道报道。埃尔多安在早些时候的一次演讲中表示，一场大规模军事行动正在叙利亚西北部的伊德利卜省展开，而自由叙利亚军叛乱团体称他们得到了土耳其的支持准备进入。NTV报道称，埃尔多安在其演讲后告诉记者，俄罗斯从空中支持了这次行动，而土耳其士兵则在内陆边境支持了这一行动。

",worldnews,"October 7, 2017 ",1
土耳其的埃尔多安说叙利亚伊德利卜进行大规模行动,"安卡拉（路透社）- 土耳其总统雷杰普·塔伊普·埃尔多安星期六表示，在叙利亚西北部的伊德利卜省正在进行一场大规模军事行动，而自由叙利亚军等反叛组织此前曾表示他们将在土耳其支持下进入该地区。

“今天在叙利亚的伊德利卜有一个严重的行动，并且将继续下去，”埃尔多安在对他的AK党成员发表演讲时说。“目前伊德利卜的大部分地区由一个由圣战者领导的战斗联盟控制。”埃尔多安说：“我们永远不会允许在我们的叙利亚边境附近出现恐怖走廊。我们将继续在其他地方采取其他措施。”",worldnews,"October 7, 2017 ",1
新西兰选举最终计票结果增强了工党在谈判中的地位,惠灵顿（路透社）-可能的工党-绿党的联合政府在新西兰最终选举统计中缩小了与执政的国家党之间的差距，在周日与掌握权力平衡的小民族主义政党进行谈判之前增强了他们的地位。9月23日大选的最后结果于周六公布，国家党赢得了56个席位，而工党和绿党共同获得了54个席位，这使得他们都需要依赖新西兰优先党的9个席位来满足议会61席多数所需的席位数。与初步结果相比，国家党失去了两个席位给工党和绿党的联盟——这一发展使工党领袖杰辛达·阿登（Jacinda Ardern）表示他们在谈判桌上的地位得到了提升。“我们将继续认真与潜在的支持党进行谈判，”阿登告诉记者说，“这意味着我们现在有了一个更强的谈判和组建一个持久、稳定的联合政府的授权。”阿登37岁，在大选前近两个月接任工党领导职务，迅速引起了加拿大贾斯汀·特鲁多和法国埃马纽埃尔·马克龙等年轻、世界主义的领导人之间的比较。她几乎单枪匹马地将工党带到了组建政府的边缘。新西兰优先党发表声明称，它将于周日下午与国家党中午举行讨论，下午与工党举行讨论。新西兰优先党领袖温斯顿·彼得斯（Winston Peters）向当地媒体透露，了解事实“使我们能够更好地做出判断”。彼得斯表示，他将在最终统计数据公布后并于10月12日结果正式宣布之后才会决定支持哪个政党。总理比尔·英格利希（Bill English）在皇后镇告诉记者说，最终的结果并没有改变谈判的性质，现在很可能将集中在经济问题上。“我认为这并没有削弱它的太多，”他说，指的是国家党的谈判立场。“基本面没有改变，那就是国家党比工党拥有更多的席位，我们比工党和绿党的组合要大。”分析人士认为，如果新西兰优先党选择与工党结盟，由于两党在政策上有更多共同之处，那么工党和绿党的集团将获得更多的席位，这将使得彼得斯更容易证明这一举动是合理的。双方都表示希望限制移民、重新协商某些贸易协议并调整中央银行的职能，尽管方式不同。如果工党、绿党和新西兰优先党组成一个以一席之差赢得多数席位的政府……那不会让很多人感到舒服，梅西大学政治学教授理查德·肖（Richard Shaw）在提到初步结果时说道。根据最终的统计数字，工党、绿党和新西兰优先党的联盟将拥有三席多数。但有人说，鉴于这将是一个简单的两党联合政府，彼得斯可能会倾向于转向国家党。这位经验丰富的新西兰政客已经三次掌握了权力的天平，在过去的大选中曾分别与国家党和工党组成了联合政府。国家党赢得了44.4%的选票，工党赢得了36.9%，新西兰优先党赢得了7.2%，绿党赢得了6.3%。,worldnews,"October 7, 2017 ",1
"新西兰反对党工党表示，在最终计票后，他们在与政府谈判时处于更有利的地位。

翻译后的内容如下：

新西兰反对党工党表示，在最终计票后，他们在与政府谈判时处于更有利的地位。",惠灵顿（路透社）-新西兰反对党工党领袖杰辛达·阿登（Jacinda Ardern）周六表示，最终选举计票结果显示，她的政党在与民族主义的新西兰优先党（New Zealand First Party）协商组建政府时处于加强地位。9月23日选举的最后统计显示，工党和其潜在联盟伙伴绿党在120个席位的议会中多出两个席位，合计达到54席。执政的国家党有56席。任何一个集团都需要拥有九个席位的新西兰优先党才能治理政府。阿登说，谈判于周四开始，将在周末继续进行,worldnews,"October 7, 2017 ",1
新西兰总理表示最终选举计票结果不会削弱他组建联合政府的可能性,惠灵顿（路透社）-新西兰总理比尔·英格利希表示，周六公布的最终选举计票结果并没有从根本上改变他的国家党与民族主义的新西兰优先党之间的谈判，以组建联合政府。9月23日选举的最终统计显示，相比选举当晚的初步统计，国家党失去了两个席位，但仍领先于反对党工党的46席，拥有56席。在被问及该党谈判立场时，英格利希对记者说：“我认为这并没有削弱它多少，基本状况没有改变。”无结果的选举结果使得两大主要政党在没有民粹主义的新西兰优先党的情况下都没有足够的选票来组成政府，而新西兰优先党拥有九个席位。,worldnews,"October 7, 2017 ",1
东京都知事小池百合子选举后留任党首一职的可能性,东京（路透社）- 东京都知事小池百合子不希望她在选举期间的新保守党推举出总理候选人，这为最终支持安倍晋三所在的执政党的国会议员敞开了大门。小池百合子的新党“希望之党”已经成为对安倍的自由民主党的一个严重挑战，但她表示她不会亲自竞选。安倍上个月宣布提前举行大选，希望能让他的执政联盟在众议院中保留多数席位，目前该党在众议院中有三分之二的优势。失去简单多数将会是一次重大的意外打击，但自民党的表现不佳可能会给安倍施加压力，迫使他辞职。当被问及《朝日新闻》周六发表的采访中，她的党派是否会在大选中从自己的人选中选出总理候选人时，她回答说：“基本上没有。”竞选活动将于10月11日正式开始。这位65岁的、前防卫大臣和前自民党成员告诉路透社，在她所在政党开会投票选出总理后，所有选项都在考虑之中。“我们需要看到选举结果。我们必须保护这个国家，同时也要改变它，”小池百合子告诉路透社说。“我们将在确认我们的‘希望之党’能够实现这一趋势之后决定。”在与《朝日新闻》的采访中，小池百合子赞扬了前防卫大臣石破茂，他在2012年赢得由安倍领导的LDP领导层竞选中获胜，并称赞总务相野田佳彦为残疾人士工作。石破茂多次批评安倍，包括他对战后宪法第九条的和平条款进行修订的建议，以澄清军队的地位。石破茂认为安倍的建议还不够彻底。野田佳彦表示，她想在下一次安倍任期于2018年9月届满时的自民党领导层竞争中参选。,worldnews,"October 7, 2017 ",1
