title,text,subject,date,label
坦桑尼亚总统披露工资，在非洲领导人中属于最低之一,"达累斯萨拉姆（路透社）——坦桑尼亚总统约翰·马古富利透露，他每月收入900万坦桑尼亚先令（4000美元），使他成为非洲最低薪水的领导人之一，因为他追求备受批评的政策，即大幅削减公共开支。周二在首都向当地官员发表演讲时，他还表示政府已削减了国有公司高管的工资，每月1500万坦桑尼亚先令（6700美元），比他的工资还要多。他们可以离开，如果他们不想这样的话，他说道。他说，国家企业的公款滥用现象非常普遍，他曾拒绝一些地方官员要求将其津贴增加一倍以上的请求，称许多公民缺乏获得水、医疗和电力的途径。自2015年11月就职以来，被称为“推土机”的马古富利通过实施限制政府官员出国旅行等措施，削减了政府支出，并从国家工资单中删除了“幽灵员工”。一些批评人士认为他的节约措施过于极端，可能会破坏东非第二大经济体的发展，并减缓采矿等关键部门的投资。马古富利的薪水只是其他非洲领导人的很小一部分。他没有其他公开的收入来源，其政府去年表示计划提交一项议会法案，禁止公职人员从事商业活动以避免利益冲突。相比之下，肯尼亚总统的月薪约为14000美元。南非总统雅各布·祖马在2015年议会提高工资后，每月领取约20000美元。自2009年以来，祖马卷入了多项丑闻和滥用职权的指控，包括在其私人住宅中使用超过50万美元不当的国家资金用于安全。其他收入较为适中的领导人包括尼日利亚总统穆罕默杜·布哈里，他在2015年5月上任时减少了50%的工资。此前，年薪定为1410万奈拉，相当于2015年年中70,000美元。

（1美元=2239.0000坦桑尼亚先令）",worldnews,"October 4, 2017 ",1
英国首相梅：我们必须争取政治主流地位,英国首相特蕾莎·梅（Theresa May）周三在年度党代会上发表演讲时表示，她的政党必须为保守党的主流政治议程而战。她说：“我们必须团结起来，为这一主流保守主义议程而战。为了在新一代中再次赢得意识形态之战，我们必须共同努力。”,worldnews,"October 4, 2017 ",1
路透社图表：巴厘岛愤怒火山带来的威胁,"路透社报道 - 印度尼西亚巴厘岛东部高耸的火山Agung正在轰鸣，迫使14万多人撤离，当局警告说它随时可能喷发。在科学家对这座火山发出最高警报后，游客纷纷避开该岛。1963年上次喷发时，这座火山造成1000多人死亡。高达3000米（码）的Agung火山是岛上最高、最神圣的火山，拥有Pura Besakih寺庙群，该寺庙群在之前的喷发中侥幸逃脱。

巴厘岛这次更有准备，在火山周围划定了12公里（7英里）的安全区，并在临时避难所储备了食物和紧急物资。这张互动图表展示了从火山喷发出的热气体、灰烬和熔岩（炸弹）潜在的风险区域。它解释了科学家如何评估火山的震动速率和类型，以确定何时会发生火山喷发。路透社图形团队还分析了火山喷发可能对该经济的影响，这个经济每年依赖近500万游客前来参观海滩和寺庙。

查看“Agung苏醒”图表：tmsnrt.rs/2ymKRSY",worldnews,"October 4, 2017 ",1
东帝汶总统宣誓就职首个少数族裔政府,"（10月3日发自帝力）东帝汶总统弗朗西斯科·卢奥洛·古特雷斯于周二宣誓就职新内阁成员，并敦促该国首个少数派政府专注于改善生活条件和避免政治动荡。由总理马里·阿尔卡蒂里领导的新的行政班子面临着提振这个130万人口国家停滞不前的石油产量的压力，失业和贫困问题依然严重。阿尔卡蒂里是东帝汶独立后的首任总理，他在2006年因解雇了600名士兵而引发骚乱后辞职。他的自由革新党在7月的选举中赢得了最多的选票，但未能获得绝对多数。

古特雷斯在总统府发表讲话时表示，该国期待在没有浪费的情况下实现良好的治理。我们的土地上的福利改善不是通过政治动荡实现的，而是通过工作、每个人的参与和奉献来实现的。现有的油田产量减少，加上商品价格疲软，给政府的预算造成了打击，阻碍了其发展制造业以推动经济增长的计划。这个前葡萄牙殖民地于1975年被邻国印度尼西亚入侵。经过长达24年的暴力抵抗运动，东帝汶于2002年实现了独立，许多关键人物至今仍在该国的运作中占据重要地位。阿尔卡蒂里作为罗马天主教国家中的穆斯林，曾在东帝汶争取独立的斗争期间流亡莫桑比克多年。诺贝尔和平奖获得者、前总理兼总统何塞·拉莫斯-霍塔上个月也宣誓就任内阁的新职务——国务部长和国家安全顾问。赫尔南尼·菲洛梅娜·科埃略·达·席尔瓦被任命为重要的石油部长。他曾在上一届政府中担任外交部长。澳大利亚与东帝汶上个月达成了一项关于海上边界的突破性协议，结束了持续十年的争端，该争端导致价值400亿美元的近海天然气项目停滞不前。这一分歧使得大太阳升气田的所有者——伍德赛德石油公司、康菲石油公司和皇家荷兰壳牌以及日本的大阪燃气公司将该项目搁置一旁。自由革新党在选举中赢得了23个席位，将与民主党联合控制国会65个席位中的30个席位。自由革新党自2015年以来一直处于事实上的联盟状态，与由前独立战士坎纳诺·古斯马奥创立的国家重建大会党结盟。",worldnews,"October 3, 2017 ",1
卢旺达指控总统批评者为煽动叛乱,基加利（路透社）——卢旺达当局周三表示，他们指控总统保罗·卡加梅的一位批评者煽动叛乱和伪造文件，原因是她在八月的选举中被禁止挑战他。检方发言人称，迪安·希玛·鲁吉拉（Diane Shima Rwigara），一位35岁的会计，多次指责卡加梅压制异议并批评自1994年卢旺达种族灭绝后取得政权以来，卢旺达爱国阵线几乎完全掌控了权力。卡加梅在八月的大选中以98.8%的选票获胜。鲁吉拉的母親阿德琳和阿姐安妮也被指控煽动、歧视和宗派主义，检方发言人法斯坦·努西（Faustin Nkusi）告诉路透社说，案件于周二提交法院，等待审判日期。这三位女性已被拘留大约两周。她们最初是在8月30日从卢旺达首都家中被带走，罪名是涉及家庭烟草公司的逃税指控。周二提交的案件并未列出这一指控。卡加梅因在种族灭绝之后恢复卢旺达的稳定并在经济复苏方面取得显著进展而赢得了国际赞誉。但人权组织指出，他曾压制独立媒体并打压潜在的民主反对派。一些政府的批评者曾被监禁或遇害。选举当局禁止鲁吉拉参加八月大选，理由是她没有提交足够的支持者签名，她提交的一些名字属于已故人士。鲁吉拉的哥哥阿里斯蒂德（Aristide）居住在美国，他说对这三名女性的指控是出于政治动机，旨在惩罚她的家族因为试图竞选总统。周三无法联系到阿里斯蒂德。努西说这些指控与政治无关。,worldnews,"October 4, 2017 ",1
独家：柬埔寨反对派领袖呼吁对领导层实施制裁,"（路透社）——一位逃往国外以躲避逮捕的前柬埔寨反对派领袖周三呼吁西方捐助国对洪森政府实施有针对性的制裁，以拯救这个东南亚国家的民主。

63岁的Mu Sochua周二离开柬埔寨时表示，她听说自己将成为最近一次镇压行动的目标，而该行动导致柬埔寨国家救国党（CNRP）反对党领袖Kem Sokha一个月前被捕并被指控叛国。

明年选举即将举行，反对党指责65岁的洪森逮捕和骚扰其领导人和其他批评者，以便延长他在位超过30年的任期。

“现在是时候采取行动了。需要的是有针对性的制裁。”Mu Sochua告诉路透社。“停止向柬埔寨政府提供技术援助。”她说上周有大约一半的CNRP国会议员逃离了柬埔寨。Mu Sochua说，这些制裁可能包括对高级官员的签证限制，但不应针对服装出口——主要是向美国和欧盟出口——这关系到数十万柬埔寨工人的生计。

回应Mu Sochua的评论，政府发言人Phay Siphan表示，没有任何理由对柬埔寨实施制裁，因为该国致力于和平、多元化和法治。

这是主权国家，它将保护自己的主权，”他说。他无法就任何潜在的逮捕发表评论，因为这将是司法部门的事务。

政府对反对派策划推翻洪森的革命计划提出指控，而洪森的统治使柬埔寨从一个在红色高棉种族灭绝后陷入崩溃的国家转变为该地区经济增长最快的经济体之一。洪森将其称为一场“颜色革命”，类似于2000年代巴尔干半岛和前苏联部分地区发生的运动。

自Kem Sokha被捕以来，Mu Sochua一直是他的最直言不讳的副手。她说周末之后，她开始感到担忧，因为疑似便衣警察跟踪她到乡村集会现场。然后周一，洪森威胁要逮捕更多反对派领导人。Mu Sochua说，一名高级政府官员给她发了一段演讲录音。

我问道：“这与我有关吗？”他说“是的”。我问：“本周会被逮捕吗？”他说“是的” ，Mu Sochua说，她因涉嫌煽动暴乱而被拘留了七天，这一罪名很容易被重新提起。政府没有透露是否打算对她进行指控。

Mu Sochua说，任何针对洪森的国际举措都应旨在维护民主。当谈到有针对性的制裁时，我们也谈论给洪森先生时间思考并调整，同时给反对派、公民社会、自由媒体空间，这样接下来的十个月将是准备选举的时间。

西方国家谴责了Kem Sokha的被捕以及对该国非政府组织、民权团体和独立媒体的打击，但他们还没有采取具体的措施。人权观察组织亚洲部副主任菲尔·罗伯逊（Phil Robertson）在一项声明中说：“令人震惊的是，国际社会，特别是柬埔寨的捐助国，基本上是在每一步打压中都给了洪森一个‘免检通行证’。”

西方捐助者在1991年结束内战的和平协议后发挥了重建柬埔寨的关键作用，但随着柬埔寨经济的增强和中国成为其最重要的盟友，他们的影响力逐渐减弱。

周二，参议员约翰·麦凯恩和迪克·杜宾提出了决议案，要求美国国务院和国库部考虑将柬埔寨高级官员列入名单，这将阻止他们访问美国。

中国是柬埔寨最大的捐助国，已经口头支持洪森。这位前红色高棉指挥官于1979年脱离该组织并帮助将其赶下台，当时估计有170万人死亡。",worldnews,"October 4, 2017 ",1
德国：法治必须在西班牙得到遵守,"BERLIN（路透社）——德国总理安格拉·默克尔（Angela Merkel）发言人周三表示，随着加泰罗尼亚向欧盟国家宣布独立的趋势加强，西班牙坚持法治以维护稳定至关重要。德国密切关注那里的局势发展。我们对西班牙的稳定有着极大的兴趣。因此，重要的是……遵守法治。

他形容马德里和加泰罗尼亚之间的冲突是内部事务，并表示任何解决方案都只能在西班牙宪法和民主秩序内进行，他还拒绝谴责周末发生的警方行动。

他补充说：“总理默克尔并没有寻求调解任务。这是西班牙的内政。”",worldnews,"October 4, 2017 ",1
"独立或死：加泰罗尼亚领导人被愤怒的基本盘困住

（请注意，由于您没有提供具体的上下文信息，我无法确定“boxed in”这个短语的确切含义和最佳翻译。在英语中，“boxed in”通常意味着被困住、陷入困境或者受到限制。然而，在不同的语境下，它可能有不同的含义。例如，在某些情况下，它可以表示一个人被迫采取某种立场或行动，而在其他情况下，它可能意味着一个人处于一个不利的位置，很难改变自己的状况。）",西班牙维多利亚（路透社）- 加泰罗尼亚独立派领袖卡尔斯·普伊格德蒙特呼吁欧盟调解与西班牙关于该地区未来的问题，但许多加泰罗尼亚人认为警方对禁止公投的严厉打击意味着妥协已经太晚了。在加泰罗尼亚分离主义重镇奥斯纳县，政客们表示，警方使用橡胶子弹和警棍对付投票者，使得独立阵营几乎没有留下任何余地。人民完全脱离了西班牙国家，奥斯纳首府维克市议会议员、小型的反资本主义政党人民团结候选人名单（CUP）成员乔安·科马说。科马去年被捕，今年6月因煽动不服从被释放。“独立将是单方面的，”他说。在上周日投票前，普伊格德蒙特的PdeCat党成员表示，他们愿意接受更大的财政和政治自主权，而不是加泰罗尼亚完全独立。然而，对马德里宣布非法的公投进行镇压所引起的广泛愤怒，使任何这样的策略都变得政治上风险巨大，因为它不太可能获得广泛的独立支持者的支持和普伊格德蒙特自己在加泰罗尼亚议会的执政联盟的支持。组织过数以百万计的分离主义者抗议活动的亲独立加泰罗尼亚国民大会（ANC）解读普伊格德蒙特的调解呼吁基本上是要求欧盟承认一个新加泰罗尼亚国家的存在。“会是欧盟提出调解谈判达成协议的建议，我坚持，这包括加泰罗尼亚的独立，”ANC发言人阿德里亚·阿尔西纳说。普伊格德蒙特周二晚上表示，他的政府将在统计完公投选票后48小时内要求由分离主义者控制的加泰罗尼亚议会宣布独立，他称这可能在本周末之前完成。这将给拉霍伊留下选择宪法暂停加泰罗尼亚政府和举行地方选举的选项。这种所谓的“核选项”可能会重新点燃不安，分离主义者正在用已故独裁者弗朗西斯科·佛朗哥的名字来形容拉霍伊的策略。在佛朗哥于1975年去世之前，加泰罗尼亚语曾被压制。欧盟发言人在回应是否会让步时拒绝置评，尽管布鲁塞尔在成员国中采取这样一步似乎并不寻常。欧盟执行机构表达了对西班牙首相马里亚诺·拉霍伊有能力处理这一“内部事务”的信任，但也呼吁双方对话并提醒马德里尊重公民的基本权利。成千上万的人周二走上加泰罗尼亚街头抗议周日的暴力镇压。这场公投让西班牙陷入了数十年来最严重的宪政危机，也是对保守派拉霍伊的政治考验。在加泰罗尼亚以外的地方，大多数西班牙人对其独立的努力持有强烈的观点。西班牙国王费利佩六世在罕见的干预中指责分裂分子领袖周二破坏民主原则并将加泰罗尼亚社会一分为二。采访了五名在奥斯纳县，一个由农场城镇拼凑而成的地区的亲独立政客，透露出在周日的暴力之后，一种不容妥协的情绪，根据加泰罗尼亚官员的说法，该地区有约900人受伤。我们失去了恐惧，托雷洛市左翼共和党39岁的议员乔丹·卡萨尔斯说。现在回头是不可能了。卡萨尔斯说，当他十多年前进入政界时，分离主义集会只吸引了几千人。根据加泰罗尼亚政府的数字，在周日，534万注册选民中有226万人投票，其中约90%支持独立。然而，工会主义者大多抵制了这次公投。当被问及他想从欧盟调解谈判中得到什么结果时，普伊格德蒙特使用了模糊的语言，可以有多种解释。周一，他表示：“这将是一场必须承诺恢复制度正常性的调解。”科马说，周日的投票率比2014年的非正式投票高出许多，据加泰罗尼亚官员称，这使得公投结果具有约束力，CUP目前正在动员当地议会开始与西班牙分裂的过程。CUP对于生存下来的分离主义的加泰罗尼亚政府至关重要，因为它迫使更大规模的政党在2015年形成亲独立的联盟。作为条件，它迫使阿图尔·马斯辞去加泰罗尼亚领导人职务，因为自2014年以来没有取得独立进展。2010年，当西班牙宪法法院否决了一项改革，这项改革承认加泰罗尼亚是一个国家，并赋予加泰罗尼亚语高于西班牙语的优先地位时，分离主义者感到愤怒。在那之后的那个星期，100万加泰罗尼亚人走上巴塞罗那的街头，这是第一次大规模的独立示威游行，口号是“我们是一个民族，我们决定！”当我们信任西班牙国家时，他们欺骗了我们。我们达成的每一项协议他们都打破了，圣彼得罗埃洛镇的市长乔丹·法布雷加说，这个小镇在2012年象征性地宣布从西班牙独立。周二，维克的公寓楼悬挂着一条横幅，上面写着“欧洲帮助我们”。到目前为止，尽管国际社会批评了镇压，,worldnews,"October 3, 2017 ",1
"支持独立的政党希望加泰罗尼亚议会于周一讨论独立：报告称

（注：此处的“report”指的是新闻报道或调查报告，而非数学中的“报告”。）","马德里（路透社）- 加泰罗尼亚独立派政党Junts Pel Si和CUP已要求议会于周一开会讨论并可能宣布该地区从西班牙独立。加泰罗尼亚报纸《先锋报》周三报道称。

地方议会的领导机构今天开会决定何时召开议会会议，以讨论一项被禁止的分裂西班牙的公投结果。在此期间，议会可以宣布独立。鉴于这项公投被宣布违宪，这一声明不会有任何法律后果，而且极不可能得到国际承认。",worldnews,"October 4, 2017 ",1
"特朗普赞扬了对波多黎各的反应，并表示危机正在拖垮预算

（注：由于图片中未显示具体内容，无法进行翻译。）","圣胡安，波多黎各（路透社）——周二，美国总统唐纳德·特朗普对联邦政府应对飓风玛丽亚袭击波多黎各造成的破坏表示满意，尽管批评称政府在应对危机时反应迟缓。在过去六周内经历了飓风哈维、艾玛和玛丽亚的特朗普在简报会上说，这些灾难正在给美国预算造成压力。“我讨厌告诉你，波多黎各，但你把我们的预算搞乱了，因为我们花了很多钱在波多黎各上，”他说。“这没关系。我们已经拯救了许多生命。”飓风袭击两周后，波多黎各约340万居民中许多人仍在没有基本生活必需品的困境中挣扎。特朗普离开波多黎后不久，总督里卡多·罗塞洛说死亡人数从16人上升至34人。玛丽亚之前，美国领土的经济已经陷入衰退，其政府因面临720亿美元的债务负担而申请破产。在与福克斯新闻台的访谈中，特朗普说该岛债务必须被消除。“他们欠你们华尔街的朋友们很多钱，我们必须把它抹掉。你要跟他们说再见，我不知道是高盛还是谁，但你可以跟他们挥手告别了，”他在访问期间接受采访说。穆迪投资服务公司周二估计玛丽亚的总成本为450亿到950亿美元，并指出需要联邦政府的重大援助。特朗普说，与卡特里娜飓风相比，联邦政府对玛丽亚的反应要好得多。卡特里娜飓风于2005年席卷路易斯安那州和密西西比州，导致1800多人丧生。“就救援而言，就拯救生命而言——16条生命就是很多——但是如果你与其他飓风中的数千名遇难者进行比较的话，那些飓风实际上并没有那么严重，”他说。飓风摧毁了该岛的电力系统，不到一半的居民有自来水供应。居民仍然难以获得手机信号或找到燃料来为发电机和汽车加油。大约88%的手机基站仍处于停机状态。在返回华盛顿的空军一号上，特朗普说这是一个“美好的一天”，他听到的都是感谢。他说：“我们只听到了来自波多黎各人民的‘谢谢’。今天我很享受。”他说当地卡车司机仍然需要帮助分发物资。在华盛顿，参议院民主党领袖查克·舒默说，共和党总统特朗普应该停止责怪波多黎各，而是开始努力改善局势。一位不愿透露姓名的白宫官员说，白宫正准备向国会要求拨款290亿美元用于波多黎各和其他自然灾害地区的援助。预计美国政府还将提出长期援助波多黎各、德克萨斯州和佛罗里达州的请求。在四个半小时的访问中，特朗普的车队驶过树叶凋零的树木和偶尔没有屋顶的房子。他与妻子梅拉尼娅在瓜伊纳布市的受灾家庭见面，走过一条满是废墟的街道。圣胡安市长卡门·尤林·克鲁兹曾批评政府应对波多黎各的方式不当。在访问期间，特朗普会见了包括克鲁兹在内的当地和联邦官员。几天前，特朗普在推特上抨击克鲁兹，指责她领导不力，并表示岛上有些人“想要别人为他们做一切”。特朗普与克鲁兹握手，但他对其他地方和联邦官员表达了温暖的赞扬。“从一开始，这位总督就没有玩政治，”他对波多黎各总督里卡多·罗塞洛说。CNN报道，克鲁兹告诉特朗普，“这是关于拯救生命；这与政治无关。”特朗普乘坐直升机参观了灾区，看到通常郁郁葱葱的山丘变得棕褐色，树枝被玛丽亚的风吹落。他还空中看到了刚刚抵达的美国海军医院船USNS Comfort。瓦伦丁·纳瓦罗，26岁，圣胡安的一名销售人员，认为特朗普的访问只是场公关活动。“我认为他是受到压力才来的，这是一次拍照机会，但我认为他不会做得比他已经做的更多——而且他已经做得很少了，”纳瓦罗说。

",worldnews,"October 3, 2017 ",1
欧洲将尽一切努力维护伊朗核协议：欧盟外交官,苏黎世（路透社）——一位高级欧盟外交官周三表示，尽管美国总统唐纳德·特朗普心存疑虑，欧洲国家仍将尽最大努力保留限制伊朗核计划的协议。这是多边协议，不是双边协议。作为欧洲人，我们将尽一切努力确保它得以维持，欧盟外交事务秘书赫尔加·施密特在瑞士金融中心举行的一次伊朗投资会议上说。该协议于2015年由包括伊朗、美国、法国、德国、英国、俄罗斯和中国在内的集团达成。特朗普正在权衡这一协议是否符合美国的利益，他面临着10月15日证明伊朗遵守协议的最后期限，这一决定可能会毁掉其他世界强国所达成的强烈支持该协议的协议。施密特说，欧洲对伊朗在地区事务中的作用有担忧，但这些问题并不是所谓的全面行动计划的一部分。我绝对确信，如果我们放弃全面行动计划，我们就无法更好地解决这些问题，她说。她补充说，世界上不需要第二个核扩散危机，一个已经太多了，这似乎是在提及华盛顿与朝鲜的对峙。英国驻伊朗大使尼古拉斯·霍普顿说，联合国原子能机构的报告显示伊朗完全遵守了协议的条件。我们希望特朗普总统会重新认证该协议，并希望美国继续在全面行动计划的实施中发挥建设性和重要的作用，他在会上说。美国国防部长吉姆·马蒂斯周二表示，除非事实证明德黑兰没有遵守协议或美国的国家利益不允许这样做，否则美国应该考虑留在伊朗协议中。虽然马蒂斯表示支持特朗普审查协议，但这位防长的观点比特朗普更为积极，后者称伊朗和六个世界大国之间的协议是“耻辱”。,worldnews,"October 4, 2017 ",1
巴黎西部的滑板车火灾引发约旦爆炸恐慌,巴黎（路透社）——警方消息人士称，周三一辆踏板车在巴黎西部约旦军事公使办公室前被点燃，此前约旦外交部发表声明说，一辆摩托车发生了爆炸。根据巴黎警察局的说法，大火蔓延到一辆外交车辆，但并没有发生爆炸的情况。一位大使馆官员表示，该事件似乎并非故意针对约旦。据大使馆官员称，一辆摩托车在大使馆所在的建筑物前爆炸。警方正在调查此事，这看起来并不是针对约旦的有意行为。约旦外交部发言人早些时候接受约旦官方新闻机构Petra通讯社采访时表示，一辆摩托车在约旦军事代表团前爆炸，但没有工作人员受伤。巴黎警察部门表示已展开调查，但没有任何迹象表明这一事件与恐怖主义有关。,worldnews,"October 4, 2017 ",1
