title,text,subject,date,label
"Skin in the Game: 菲律宾学生裸奔抗议杜特尔特

注意：由于“skin in the game”这个短语在英语中已经是一个固定的表达方式，因此在翻译时保留了原英文短语，并在其后面加上中文解释“游戏中的皮肤”。这样可以更好地传达原文的意思，同时保留了一些地道的英语表达方式。","马尼拉（路透社）——菲律宾一所大学的学生兄弟会利用他们每年一次的裸跑来抗议总统罗德里戈·杜特尔特对毒品问题的残酷战争和对南部实施军事管制。这些戴着面具和兜帽的年轻男子在他们的校园里奔跑，手中举着标语牌，上面写着“解除军事管制”和“停止杀人”，旁观者笑着指指点点，其他人则拍照留念。

阿尔法菲奥米亚发言人托马斯·罗卡说：“社会的暴力程度正在增长，兄弟会不能无视这一点，成千上万的人在死亡。”

自从去年6月就职以来，杜特尔特发动了一场激烈的禁毒战争，导致数千名菲律宾人丧生，今年5月，他在人口超过2200万的民答那峨岛宣布实行军事管制，因为与伊斯兰国有关的武装分子占领了马拉维市的大部分地区。

这并不是第一次这个兄弟会在他们的年度赤身裸体活动中采取政治立场。该社团在20世纪80年代独裁者费迪南德·马科斯统治期间曾使用裸跑活动来抗议菲律宾大学学生活动家的审查制度。

星期五晚上，男人们聚集在一个池塘边，手臂搭在彼此肩膀上，热情地唱起了他们的兄弟会歌曲，观众席上的校友们也加入其中。

“这是我第一次看到这样的场面，”大学生哈吉·瓦多微笑着说，“但对我来说，他们的做法很有效果，能够引起人们对这些问题关注。”",worldnews,"December 1, 2017 ",1
乔治亚表示伊斯坦布尔机场爆炸案的嫌疑人上周被击毙,"第比利斯（路透社）——格鲁吉亚国家安全局发言人周五表示，上周在原苏联国家格鲁吉亚的一次特别行动中，一名被怀疑是策划了2016年伊斯坦布尔机场袭击事件的伊斯兰国前战士被击毙。土耳其媒体和美国国会议员都称阿赫迈德·查特耶夫是2016年伊斯坦布尔机场自杀式爆炸案的幕后主使。但这一说法尚未得到土耳其官方证实。

“确认在这次行动中被杀害的人之一是阿赫迈德·查特耶夫，”格鲁吉亚国家安全局发言人尼诺·乔治比安尼在一次新闻发布会上说。乔治比安尼表示，查特耶夫引爆了自己。

同一行动中，一名格鲁吉亚特种部队士兵和两名其他武装分子（涉嫌恐怖主义）被击毙。四名警察受伤，该组织的另一名成员被捕。此次20小时的行动发生在上周，地点位于格鲁吉亚首都第比利斯郊外的一处公寓楼内。乔治比安尼拒绝透露另外两名被击毙的武装分子的姓名，也没有透露被捕者的身份、该组织的目的地以及他们是如何到达格鲁吉亚的。

乔治比安尼说：“调查正在进行……我们与国际合作伙伴一起继续工作以确定另外两人。”她补充说，美国专家参与了调查。

联合国制裁名单显示，查特耶夫是伊斯兰国的资深人物，负责培训讲俄语的战士。他曾在车臣与莫斯科冲突中失去一只手臂，并在格鲁吉亚潘基西峡谷居住，那里主要由来自19世纪移民到主要为基督教国家的车臣人组成。当苏联解体后，车臣爆发了对莫斯科统治的武装反抗，车臣社区也加入了战斗。数千名难民从车臣涌入，一些叛乱分子利用峡谷作为重新集结和准备新攻击的基地。2012年8月，查特耶夫在格鲁吉亚受伤并被逮捕，当时格鲁吉亚警方与一群据称试图穿越格俄边境前往达吉斯坦的激进分子发生冲突。",worldnews,"December 1, 2017 ",1
"前方道路漫长：受伤朝鲜脱北者迈向新生活之路

请注意，由于您提供的标题中包含“wounded”一词，我无法直接判断该词是否与图片相关联。如果您能提供更多上下文或相关信息，我可以更好地回答您的问题。",首尔（路透社）——上个月试图逃往南方的朝鲜士兵可能已经死里逃生，但官员和其他脱北者表示，即使他的健康状况在改善，他也要几个月甚至几年才能在韩国找到正常的生活。从孤立和贫穷的北方到民主和繁荣的南方生活的转变对任何脱北者来说都是困难的，更不用说一个来自精英边境部队、拥有潜在军事情报和高知名度的士兵了。这名24岁的士兵只以其姓氏Oh闻名，他在大胆逃脱时被击中五次后已脱离重症监护，但仍需与乙型肝炎作斗争，这可能会推迟他转移到军队医院的时间，医生们说。一位参与安置朝鲜难民的前韩国政府官员告诉路透社：“现役士兵脱逃者拥有最新信息，情报机构会询问这些士兵，看看是否需要解决我们军队作战计划和战斗中的问题。”Oh可能会受到韩国国家情报局的保护，然后被安排从事密码破解等军事或相关机构的工作，这位前韩国高级政府官员说。“决定将在全面评估他对国家安全意味着什么、他所掌握的信息水平以及他是否有能力与其他脱北者在安置中心混在一起之后做出，”这位前官员说。现役士兵脱逃极为罕见，每年一次或更少。根据韩国国会议员透露的情况，情报部门急切地想要询问曾驻扎在靠近高度戒备边界的联合安全区的Oh。医生要求官员在他身体和心理完全康复后再开始询问。考虑到他高调的逃跑和他作为精英边境部队成员的身份，这位前韩国官员说，Oh很可能会得到个性化的帮助，远离其他朝鲜脱北者在韩安村安置中心的经历。大多数脱北者在国家安全局接受几天至数月的审问后被送到韩安村安置中心。在那里，他们必须接受为期三个月的资本主义生活教育，从乘坐公共交通工具到开设银行账户到创建电子邮件地址。这是你第一次看到外面的世界，他们会带你出去见街上的陌生人并学习如何进入社会服务网络。现在，你可以和一个普通的韩国家庭一起做寄宿家庭，”35岁的脱北者Ji Seong-ho说。他是Now，Action and Unity for Human Rights（NAUH）的负责人，该组织拯救和安置朝鲜难民。29岁的金进洙是前朝鲜秘密警察成员，2011年逃到南方。他说：“这样的培训对不同的人有不同的用处。回顾过去，如果教一些现实的东西，比如如何准备招聘会和寻找合适的工作场所以及为什么重要，即使这可能让人们感到沮丧，那将非常有用。”在离开韩安村后，你会像一岁大的婴儿一样。但是当你真正独自一人时，这些东西会成为真正的障碍，”目前在首尔一家广告公司工作的金先生说。离开韩安村后，中央和地方政府向每位脱北者提供一年内7000万韩元（6450美元）现金，仅占韩国平均收入的五分之一，并提供住房、教育和职业培训方面的支持。警察被分配给每个脱北者以确保他们的安全。Oh可能有价值于韩国政府或试图突出朝鲜状况的组织，但他自己是否愿意生活在聚光灯下还是未知数，自由朝鲜国家主任Sokeel Park说。Park说：“如果他打算参与那种事情，那么各种各样的媒体或非政府组织都会争相给他提供一个平台。”但如果他恢复良好并且选择融入其中，那么他就只是一个有着模糊背景的年轻人。图表：脱北者勇敢面对枪林弹雨reut.rs/2zAUDRN,worldnews,"December 1, 2017 ",1
阿根廷放弃搜救失踪潜艇船员任务,"布宜诺斯艾利斯（路透社）——阿根廷海军发言人周四表示，尽管将继续与国际援助一起搜寻该艘潜水艇，但阿根廷已经放弃营救44名船员的希望。潜水艇“圣胡安”号在11月15日报告其最后位置时还有为期七天的空气供应。当潜水艇通过呼吸管进水后，船员们被命令返回马德普拉塔的一个海军基地。海军发言人恩里克·巴尔比在新闻发布会上说，超过双倍的天数过去了，本有可能营救船员，我们将继续搜索……不会有人员获救。

一些家庭成员批评政府放弃了营救行动，并对其沟通方式提出质疑。Luis Tagliapietra的儿子也在那艘潜水艇上，他说大约有12个家庭是从电视新闻会议上得知救援任务已被放弃的消息。他还告诉电视台TN，政府在周一确认进入潜艇的水导致短路方面反应太慢。海军早些时候曾表示，国际组织在11月23日探测到一种声音，这可能是潜水艇失联当天发生的爆炸声。Tagliapietra说：“我想知道发生了什么，我不相信任何官方假设。”他的声音有些颤抖。“我无话可说。”

一些家庭仍然抱有奇迹出现的希望，正在组织祈祷团体。巴尔比说，共有28艘船只、9架飞机和4000人来自18个国家参与了这次覆盖557万海里的搜救行动——包括雷达监控在内。尽管我们进行了大规模的搜索，但仍未能找到该潜水艇。",worldnews,"November 30, 2017 ",1
金正男携带神经毒剂解毒剂，马国法院获悉,"KUALA LUMPUR (Reuters) - Kim Jong Nam, the murdered half-brother of North Korea s leader, had a dozen vials of antidote for lethal nerve agent VX in his sling bag on the day he was poisoned, a Malaysian court was told  this week. Two women, Indonesian Siti Aisyah and Doan Thi Huong, a Vietnamese, are charged with conspiring with four North Korean fugitives in the murder, making use of banned chemical weapon VX at the Kuala Lumpur international airport on Feb. 13. The vials contained atropine, an antidote for poisons such as VX and insecticides, toxicologist Dr K. Sharmilah told the court on Wednesday, state news agency Bernama said. However, she did not know if the vials were marked in Korean, she said when cross-examined by Siti Aisyah s lawyer, Gooi Soon Seng.   Kim Jong Nam, who was living in exile in Macau, had criticized his family s dynastic rule of North Korea and his brother had issued a standing order for his execution, some South Korean lawmakers have said. Malaysia was forced to return Kim Jong Nam s body and allow the suspects hiding in the embassy to return home, in exchange for the release of nine Malaysians barred from leaving Pyongyang. On Thursday, a police witness told the court Huong had the opportunity to dispose of a T-shirt and short skirt she had worn during the alleged attack. The T-shirt, bearing the word  LOL , and the skirt could have easily been found in a pile of clothes in the hotel room where Huong stayed, the witness, Nasrol Sain Hamzah, an assistant superintendent, told Huong s lawyer, Hisyam Teh Poh Teik.  Earlier, Nasrol told the court that he needed Huong to point out the clothes which had been concealed when the police raided. Defence lawyers say Siti Aisyah and Huong, arrested in Kuala Lumpur within days of the killing, were duped into thinking they were playing a prank for a reality TV show and did not know they were poisoning Kim Jong Nam. North Korea has denied accusations by South Korean and U.S. officials that Kim Jong Un s regime was behind the killing. The court hearings, which have run more than a month, are to resume on Jan. 22. ",worldnews,"December 1, 2017 ",1
日本天皇明仁将于2019年4月30日退位,"东京（路透社）- 明仁天皇，在近三十年的日本王位上，大部分时间都在寻求抚平二战创伤，将于2019年4月30日退位——这是约两个世纪以来日本皇室的首次退位。由十名立法者、皇室成员和最高法院法官组成的皇家事务会议，由首相安倍晋三主持，于周五同意了这一时间安排。明仁天皇将于12月23日迎来84岁生日，他去年曾表示担心年龄可能会使他难以履行职责。他将由57岁的继承人、皇太子德仁继承皇位。安倍在宣布推荐时告诉记者：“这是我第一次看到天皇退位已有200年的历史，也是根据战后宪法进行的第一次退位。我深感情感，今天，皇家事务委员会的意见得以顺利决定，并迈出了皇位继承的重要一步。”内阁仍需签署日期决定，这将在下周进行。战后的日本宪法将皇帝定义为“国家统一和人民的象征”，但并无政治权力。明仁天皇与皇后美智子一起，花了很多时间试图解决二战的遗产问题，这场战争是以他的父亲裕仁的名义进行的，安慰灾难或其它不幸事件的受害者。他深受普通日本人的尊敬。“天皇和皇后一直全心全意地为人民着想，”72岁的护理员伊藤知子说，“现在他已经老了，我希望他能好好休息一下。”明仁天皇和美智子皇后是第一位与平民结婚成为日本皇室的成员，他们努力缓和亚洲各国之间的紧张关系，这些国家因二战期间日本的侵略而关系恶化。他们多次出访国外。1992年，他成为了有史以来首位访问中国的日本君主，当时中国人民对战争的痛苦记忆犹新。在那次访问中，天皇表示他对“我国给中国人民带来了巨大苦难的不幸时期”深感遗憾。自从安倍晋三于2012年上台以来，明仁天皇一直呼吁日本人不要忘记战争的恐怖，自那时起，由于安倍寻求采取一种不那么道歉的姿态来处理日本过去的军事侵略，他的话引起了越来越多的关注。“他重新定义了这个职位。他想现代化皇室，照顾未完成的事务……并将皇室更接近人民，”日本神户大学亚裔研究主任杰弗里·金斯顿说。“他在所有方面都取得了惊人的成功。他备受推崇和尊重。他的道德权威是无庸置疑的。”一旦明仁天皇退位，一个新的“帝国时代”将开始，取代始于1989年1月8日的当前“和平时代”。日本使用西方格里高利历法，但也保留了古老的习俗，即新的天皇登基标志着新的时代的到来。上次日本皇帝退位是在1817年。战后法律不允许退位，因此6月份通过了一项一次性法律，让明仁天皇退位，但具体细节如时间安排留待以后确定。有人最初提议他在2018年底退休，也就是他登基的第30年，但由于担心这与当时的仪式和其他职责冲突而被拒绝。另一个考虑过的日期是2019年3月31日，这一年结束时的商业年度。但随后的仪式将与许多人忙碌的时间以及4月初的国家地方选举相冲突，首席 Cabinet Secretary 赤松义久说。一些日本人哀叹这个过程太慢了。“对我来说也是一样——生命并不长久，”79岁的退休人员西泽正太郎说。“应该在他仍然精力充沛的时候尽快满足他的愿望。”退位法没有解决日益老龄化和萎缩的皇室未来的问题，也没有涉及女性是否应被允许登上王位的相关问题。11岁的王子悠仁，是明仁天皇的小儿子秋筱宫亲王的儿子，将是天皇的唯一孙子，在退位后排在父亲的第二位。皇太子妃的16岁女儿爱子公主不能继承男性专用的王位。

",worldnews,"December 1, 2017 ",1
前加泰罗尼亚内阁成员将被引渡至最高法院,马德里（路透社）——八名现任监禁中的前加泰罗尼亚内阁成员将于周五出庭受审，此前他们要求在12月21日举行的地方选举之前获释。被解职的地区副总统Oriol Junqueras是ERC党在选举的主要候选人之一，他要求允许离开监狱以便参加由马德里召集的投票。Junqueras和其他七名加泰罗尼亚地区内阁的前成员于11月2日因煽动、叛乱和挪用公款罪被拘留等待审判，此前该地区政府宣布从西班牙独立。10月1日的全民投票被西班牙宣布违宪，随后富裕的东北部地区的独立宣言使西班牙陷入了几十年来最严重的政治危机，导致马德里对巴塞罗那实施直接统治。这八名被监禁的内阁成员最初在西班牙高等法院接受听证，后来他们的案件被转移到最高法院，因为主审法官认为不同的加泰罗尼亚案件应该在同一个法庭上审理。今年早些时候，最高法院以150万欧元的保释金释放了加泰罗尼亚议会主席Carme Forcadell，前提是她同意放弃任何违反西班牙宪法的政治活动。根据他们的律师的说法，所有八名前内阁成员都表示会遵守一项规定，即给予马德里控制该地区的主导权，尽管其中一些人表示不同意这一前所未有的举措剥夺了反叛政府的权力。12月21日选举的竞选活动将于周日凌晨开始，亲独立派政党将其视为一次事实上的全民投票，决定是否脱离西班牙。流亡比利时并受到西班牙逮捕令的前加泰罗尼亚领导人Carles Puigdemont称这场选举是该地区历史上最重要的一次。最近的一项调查显示，只有四分之一的加泰罗尼亚人希望继续建立一个独立的国家的计划。然而，民意调查显示，选民意见分歧很大，一方面是寻求从西班牙独立的政党，另一方面是那些希望留在统一国家内的政党。加泰罗尼亚公民团体Asamblea Nacional Catalana（ANC）和Omnium Cultural Jordi Sanchez和Jordi Cuixart的领导人——两人上月被捕——也将在最高法院就他们在独立运动中的作用作证。,worldnews,"December 1, 2017 ",1
教皇在孟加拉国任命神父，提前与罗兴亚人见面,"达卡（路透社）——教皇方济各于周五在户外举行了一场盛大的弥撒，任命了来自孟加拉国的新的神职人员，这是他首次在该国停留的第一天，当天晚些时候他将与缅甸穆斯林罗兴亚难民会面。超过10万人参加了在达卡的苏尔拉瓦迪乌丹公园举行的弥撒，该公园是孟加拉国独立纪念博物馆所在地，教皇乘坐敞篷教宗车抵达。孟加拉国人口1.69亿人中，天主教徒仅占不到百分之一。

我知道你们中的许多人是从远方来的，为了进行为期两天以上的旅行，感谢你们的慷慨。这表明你们对教会的爱。

在周五稍后的一个跨宗教集会上，教皇预计将与18名从缅甸逃到孟加拉国的罗兴亚难民见面，缅甸当局被美国和联合国指责犯下种族灭绝罪。政府否认有不当行为。在呼吁缅甸和平时，他没有使用“罗兴亚”一词来描述难民，这一词遭到了仰光政府和军队的争议。这些难民是从科克斯巴扎尔带到孟加拉国首都的，此前已有62.5万名罗兴亚人从缅甸若开邦逃离至该地。这场大迁徙是在8月25日罗兴亚武装分子袭击军营和警察局后，缅甸军方进行的镇压行动引发的。数百个罗兴亚村庄被烧毁，到达孟加拉国的难民讲述了杀戮和强奸的故事。周四晚上，教皇呼吁采取果断措施解决导致难民危机的政治原因，并敦促各国帮助达卡政府应对这一问题。",worldnews,"December 1, 2017 ",1
土耳其黄金交易商指控埃尔多安参与伊朗洗钱,（路透社）- 一名土耳其-伊朗黄金交易商周四在纽约联邦法院告诉陪审团，土耳其总统雷杰普·塔伊普·埃尔多安授权了一项交易计划，以帮助伊朗逃避美国制裁。Reza Zarrab正在与美国检察官合作，对一名被指控帮助伊朗洗钱的土耳其银行高管进行刑事诉讼。在所谓的阴谋发生时，埃尔多安是土耳其总理。Zarrab说，他得知土耳其经济部长Zafer Caglayan表示，埃尔多安和当时的财政部长Ali Babacan授权两家土耳其银行Ziraat Bank和VakifBank为伊朗转移资金。Ziraat和VakifBank都否认参与该计划。埃尔多安发言人以及Babacan顾问无法立即联系上。CNN Turk报道称，埃尔多安周四早些时候表示，土耳其没有违反美国的制裁。埃尔多安政府的发言人说，这起案件是一场“针对土耳其的阴谋”。这是Mehmet Hakan Atilla的第三天出庭受审，他是土耳其国有Halkbank的高管，在曼哈顿联邦法院不认罪。美国检察官已起诉9人参与帮助伊朗逃避制裁的计划，但只有Zarrab和Atilla被美国当局逮捕。两天作证期间，Zarrab告诉陪审员，他帮助伊朗使用存放在Halkbank的资金购买黄金，这些黄金被走私到迪拜并兑换成现金。周四，他说，由于美国制裁的变化，他在2013年不得不停止黄金交易，开始通过虚假食品采购来转移资金。Zarrab说，Atilla与Halkbank前总经理Suleyman Aslan一起设计了黄金交易。周四，Zarrab讨论了2013年他与Atilla的一次电话通话，当时他计划从黄金交易转向虚假食品销售。他说，Atilla当时并不理解不会有真正的食物运送到伊朗，因此不愿批准该计划。Zarrab称Aslan命令Atilla允许这笔交易。Zarrab作证称，在他的计划中，他贿赂了Aslan和前土耳其经济部长Zafer Caglayan。Caglayan和Aslan均被控告。路透未能联系上Caglayan或Aslan评论。土耳其政府曾表示Caglayan依法行事，而Halkbank也表示其行为合法。Caglayan此前表示，2013年土耳其的一项腐败调查中被驳回的类似指控是“毫无根据的指控”。,worldnews,"November 30, 2017 ",1
爱尔兰表示希望在12月14日峰会之前就英国脱欧边境达成“一致措辞”。,伦敦（路透社）- 外交部长西蒙·考文尼在周五接受BBC电台采访时表示，爱尔兰希望英国能保证在脱欧后，它和北爱尔兰之间不会有监管差异。他说，爱尔兰希望在12月14日的欧盟峰会上达成一个一致的措辞，以便我们可以同意解决方案的范围，以防止爱尔兰岛上重新出现边界。避免所谓的“硬边界”是英国与欧盟进行未来贸易关系谈判以及可能的两年脱欧过渡期协议的最后一大障碍。考文尼说，爱尔兰不能被要求“跳入黑暗中”。,worldnews,"December 1, 2017 ",1
特朗普考虑承认耶路撒冷是以色列的首都：官员们说,"华盛顿（路透社）——美国官员周四表示，特朗普总统正在考虑承认耶路撒冷是以色列的首都，这一举动可能会颠覆几十年来美国的政策，加剧中东紧张局势，但预计此举将再次推迟他竞选期间承诺将美国大使馆迁往那里的计划。在几个月的白宫激烈讨论之后，特朗普可能下周宣布一项寻求在国内政治需求和地缘政治压力之间取得平衡的计划，这两个因素都在围绕以色列-巴勒斯坦冲突的核心问题上：耶路撒冷的地位，那里有犹太教、伊斯兰教和基督教的神圣场所。

这些官员说，特朗普正在权衡一个计划，在该计划中他将宣布耶路撒冷是以色列的首都，这与白宫的前任们坚持认为这一问题必须在和平谈判中解决的观点相违背。巴勒斯坦人希望东耶路撒冷成为他们未来国家的首都，国际社会不承认以色列对整个城市的所有权。

特朗普的这一举动可能会激怒巴勒斯坦人和更广泛的阿拉伯世界，并可能削弱特朗普政府重启长期停滞的中以和谈的努力。然而，这可能会满足帮助他赢得总统宝座的亲以色列右翼基础，也会让以色列政府满意，后者是美国亲密盟友。

据官员透露，特朗普很可能会继续其前任的政策，签署一份六个月的豁免令，推翻一项要求将美国大使馆从特拉维夫迁至耶路撒冷的1995年法律。但是，正在考虑的一个选项是特朗普下令他的助手制定一个更长期的使馆搬迁计划，以表明他打算最终这样做。然而，美国官员警告说，该计划尚未最终确定，特朗普仍有可能改变其中的部分内容。“关于此事还没有做出决定，”美国国务院发言人海瑟·诺特周四表示。

特朗普去年竞选时曾承诺将大使馆从特拉维夫迁往耶路撒冷。但在6月份，他表示为了“最大化”由女婿兼高级顾问贾里德·库什纳领导的推动和平努力的机会，他放弃了这项要求。这些努力几乎没有取得任何进展。耶路撒冷的状况是实现以色列与巴勒斯坦之间的和平的主要障碍之一。以色列在1967年的中东战争中占领了阿拉伯东耶路撒冷，后来将其吞并，但这在国际上没有得到认可。巴勒斯坦领导人、阿拉伯国家和西方盟友一直敦促特朗普不要进行大使馆搬迁，这将违反几十年来的美国政策，事实上承认以色列对耶路撒冷全部地区的所有权。

然而，如果特朗普决定宣布耶路撒冷是以色列的首都，即使没有命令搬迁大使馆，也肯定会引发国际社会的强烈反应。关键问题是这样的声明是否会正式成为总统行动的一部分，还是仅仅是一份象征性的声明。特朗普的一些高层助手私下敦促他履行竞选时的承诺，以满足包括福音派基督徒在内的各种支持者，而其他人则警告说，这可能损害美国与穆斯林国家的关系。",worldnews,"November 30, 2017 ",1
