title,text,subject,date,label
西班牙封锁了超过一半原定用于加泰罗尼亚选举的学校,巴塞罗那（路透社）- 西班牙政府周六表示，警方已封锁了加泰罗尼亚地区被指定为禁令禁止的独立公投投票站的2315所学校中的1300所。一位官方消息人士称，有163所学校已被指定为投票中心并被家庭占据。支持公投的人们在学校过夜，试图阻止加泰罗尼亚地方警察局长的命令，该命令要求在周日早上6点前疏散并关闭投票站，而投票将于上午9点开始。,worldnews,"September 30, 2017 ",1
"Egypt ""hunting down"" gays, conducting forced anal exams - Amnesty","CAIRO (Reuters) - Six Egyptian men arrested for  promoting sexual deviancy  and  debauchery  on social media will be subjected to anal examinations ahead of their Oct. 1 trial, Amnesty International said on Saturday. Their arrest is part of a wider crackdown against homosexuality that started last week when a group of people were seen raising a rainbow flag at a concert, a rare public show of support for lesbian, gay, bisexual and transgender rights in the conservative Muslim country. At least 11 people have since been arrested, Amnesty said, and one man has been sentenced to six years in jail after local media launched a highly critical campaign against those who raised the rainbow flag at a Mashrou  Leila concert, a popular Lebanese alternative rock band whose lead singer is openly gay. Amnesty said the Forensic Medical Authority was due to subject the six men to anal examinations to determine whether they have had homosexual sex. Judicial sources said any defendant accused of  debauchery  or  sexual deviancy , a euphemism for homosexuality in Egypt, is subjected to a medical examination based on an order from the Public Prosecutor.  Allegations of torturing or insulting those medically examined are lies not worth responding to. The examinations are carried out by a forensic doctor who swore to respect his profession and its ethics,  one judicial source said.   Amnesty said such examinations violate the prohibition of torture and other ill-treatment under international law.   The fact that Egypt s Public Prosecutor is prioritizing hunting down people based on their perceived sexual orientation is utterly deplorable. These men should be released immediately and unconditionally   not put on trial,  said Najia Bounaim, North Africa Campaigns Director at Amnesty International.  Forced anal examinations are abhorrent and amount to torture. The Egyptian authorities have an appalling track record of using invasive physical tests which amount to torture against detainees in their custody. All plans to carry out such tests on these men must be stopped immediately.  Egypt s Muslim religious establishment is voicing its support for the government s moves against homosexuals.  Al Azhar will stand against calls for sexual perversion the same way it has stood against extremist groups,  a preacher at the 1,000-year-old seat of Sunni Muslim learning said in his Friday prayers sermon. Although homosexuality is not specifically outlawed in Egypt, it is a conservative society and discrimination is rife. Gay men are frequently arrested and typically charged with debauchery, immorality or blasphemy. The largest crackdown on homosexuals took place in 2001, when police raided a floating disco called the Queen Boat. Fifty-two men were tried in the case. ",worldnews,"September 30, 2017 ",1
加泰罗尼亚人占领投票站以反抗马德里停止公投的命令,巴塞罗那（路透社）——加泰罗尼亚独立的支持者于周五开始占领投票站，这可能引发与警察之间的冲突，警方已被要求在周日凌晨清除他们，以确保公投无法进行。中央政府已派遣数千名警察增援以阻止人们投票，并试图拆除该政府认为非法的公投所需的基础设施，坚称公投不会举行。然而，加泰罗尼亚领导人卡尔斯·普伊格德蒙特在接受路透社采访时表示：“在2000多个投票点一切都准备就绪，以便有选票箱和选票，以及一切人们需要的东西来表达他们的意见。” 在巴塞罗那举行的公投活动闭幕集会上，乐队演奏音乐，人们在舞台上用大号白色字母写着“公投是民主”的口号，许多披着红黄相间加泰罗尼亚旗帜的人们欢呼雀跃。准备在投票站露营以违抗法院关闭命令的人也情绪高涨。 在巴塞罗那的一所学校里，一名名叫赫克托的当地居民说，五到六户家庭将在那里过夜。“我们希望确保学校开放供活动使用，晚上如果他们来清理或腾空的话，会有家庭睡觉或者有人待在街上，”他补充说，他们计划周六打乒乓球和做海鲜面食fideuà。 加泰罗尼亚地区警察的头目下令警官们在投票开始前，即周日早上6点之前疏散并关闭投票站。在《先锋报》报纸上发表的一份内部备忘录中，警长表示只有在万不得已的情况下才应该动用武力。文件指出，“在任何时候，在使用武力之前，你必须考虑到这种警务行动可能产生的后果，避免局势升级，特别是在人群中有儿童、老人或其他弱势群体时”。 目前为止，被称为Mossos的加泰罗尼亚警察，这个在八月伊斯兰教恐怖袭击后受到爱戴的力量，一直表现出友好的态度。Mossos来看我们在做什么，他们看到我们在开派对，45岁的费兰·塔贝纳说，他和女儿一起在学校。“如果情况变得复杂，我们会和平地呆在里面，他们不会把我们赶走。” 组织者说，已经有60000人注册参加大规模的学校熬夜活动，即使他们被禁止投票，他们也称之为“和平抵抗”。 “我不相信会有人使用暴力或想要挑起暴力，这会让加泰罗尼亚独立运动作为和平主义者的无可挑剔的形象受损，”普伊格德蒙说。 在新闻发布会上，地方官员展示了一个带有地区政府徽章的白塑料投票箱。普伊格德蒙说，超过6000个投票箱正在一个秘密的地方存放。警方已经没收了成千上万的选票，法庭对地区官员处以罚款并威胁要逮捕他们。加泰罗尼亚高等法院要求谷歌删除加泰罗尼亚政府用来传播投票信息的智能手机应用程序。公司发言人表示，当收到法院命令时会移除内容。马德里方面声称宪法规定该国不可分割，坚决反对投票，但也表达了希望周日能和平的愿望。 政府发言人Inigo Mendez de Vigo重申，10月1日不会有公投，并表示组织者将会因为尝试举办公投而面临刑事指控。 有迹象表明，预计周日将有大量人群聚集街头，百货商店连锁店El Corte Ingles宣布将在巴塞罗那市中心关闭三家门店。中央政府表示，城市上空的部分空域将被限制。评级机构标准普尔表示，尽管它不期望富有的边境法国地区的加泰罗尼亚从西班牙分离出去，但马德里和巴塞罗那之间长期紧张关系可能会对该国经济增长前景产生负面影响。,worldnews,"September 29, 2017 ",1
"警方将于周日从加泰罗尼亚投票站移走人员：政府消息人士称

（请注意，由于原文中“Catalan”一词可能存在多种译法，这里选择了“加泰罗尼亚”这一常见译法。如果您需要其他译法，请告知我。）","巴塞罗那（路透社）——一位政府消息人士周六表示，警方将于周日从加泰罗尼亚独立公投投票站清除人员，但未透露如何执行这一行动的具体细节。这位官方消息来源说，由警方决定如何清除人员。负责投票站的志愿者和参与禁止的加泰罗尼亚独立公投的国家人口普查将在周日的活动中面临最高30万欧元（354,360美元）的罚款，该消息源称。",worldnews,"September 30, 2017 ",1
肯尼亚监察机构表示正在调查警方在大学采取的行动,(9月29日修正了第三段中的选举日期) 内罗毕（路透社）- 一位肯尼亚政府监督机构周五表示，它正在调查警方是否在周二的抗议活动中袭击了内罗毕大学的学生。周四，警察向抗议学生发射催泪弹。当天晚些时候发布的一段视频显示，制服警员在宿舍和教室内外用警棍殴打那些似乎没有参与校园抗议的人。这是自8月8日举行的总统选举被最高法院取消后，警方对示威的最新镇压行动。10月26日将重新举行投票。独立警察监督局（IPOA）今天早上从社交媒体上报道的一起事件中注意到，国家警察服务人员据说闯入内罗毕大学并袭击该机构的学生的消息。该机构在其推特上表示，要求任何公众成员站出来提供信息以帮助调查。学生们于周三抗议议员保罗·奥吉利·欧诺被捕，就在他因在竞选集会上称总统乌胡鲁·肯雅塔是“狗的儿子”而被保释出狱后不久。肯尼亚是该地区经常发生暴力的一个关键西方盟友国。在至少28人在8月8日的投票后的动荡中被杀害之后，人们密切监控着重新举行选举的准备情况。IPOA监察机构是在2011年成立的，当时警察因为2007年有争议的选举期间导致大量抗议者死亡而受到严厉批评。当时的暴力事件造成约12000人丧生。但当地和国际人权组织说，这个机构正努力履行其职责，调查该国充斥着平民报告的安全部队非法处决的警察暴行指控。IPOA在过去四年里已经获得了两名警察的定罪。这个监管机构上个月承诺加快调查一些高调死亡案件，比如一名婴儿在选举后的暴力中据称被警察打死的事件。[L4N1L34FC] 但了解这些调查进展的人士说，警方并未与他们合作，而且警察部队和内政部的资深官员坚称，警官们只杀死了小偷和恶棍。,worldnews,"September 29, 2017 ",1
伊朗、伊拉克政府军将举行联合边境演习——伊朗电视台,迪拜（路透社）-伊朗和伊拉克中央政府军队将在其边境附近举行联合军事演习，伊朗国家电视台周六报道说，这是德黑兰在库尔德独立公投后支持巴格达的努力的一部分。国家电视台援引一位军方发言人说，决定举行这场军事演习是在一次伊朗军事指挥官会议上做出的，会议还同意采取措施建立边境安全并接收驻扎在边境哨所的伊拉克部队。,worldnews,"September 30, 2017 ",1
莫斯科否认乌克兰指控其驻扎在白俄罗斯军队,"莫斯科（路透社）- 参与在邻国白俄罗斯举行的军事演习的俄罗斯军队已返回基地，一名俄罗斯将军周六表示。据塔斯社报道，伊戈尔·孔申科夫少将称，参与2017年“西方”联合战略军事演习的俄军部队都已回到其常驻地。

“西方”是俄语中“西部”的意思。孔申科夫是在乌克兰总司令维克托·穆任科说，尽管承诺不会留下军队，但俄罗斯在举行完军事演习后留下了军队之后发表这番话的。基辅和莫斯科的关系在2014年俄罗斯吞并克里米亚半岛以及支持乌克兰东部爆发的分离主义叛乱后急剧恶化，这场叛乱造成超过1万人死亡。

穆任科告诉路透社，俄罗斯只从白俄罗斯撤出了几个单位，并且对最初有多少士兵在那里撒了谎。孔申科夫称穆任科关于俄罗斯在白俄罗斯的军队的言论是一种幻想。他说这些评论是“这样的行政官员立即辞职的理由”，指的是穆任科。

白俄罗斯国防部发言人表示，最后一批俄罗斯军队和装备于9月28日星期四离开白俄罗斯。",worldnews,"September 30, 2017 ",1
德国警方逮捕了涉嫌超市勒索企图的嫌疑人,柏林（路透社）——德国警方周六表示，他们逮捕了一名涉嫌勒索者，该人试图通过在婴儿食品中放入可能致命的毒药来迫使超市支付数百万欧元。康斯坦茨市西南部湖畔的警察说，他们将要求法官批准延长对周五晚上由警察特种部队逮捕的这名55岁的德国男子的拘留期，因为他们认为他是主要嫌疑人。“怀疑已经得到证实，”他们在一份声明中说。9月中旬，一名嫌疑人在安全摄像机中被拍摄到在一些南部德国超市的产品中放置了大量的毒药。他通过电子邮件告诉警方是他干的，并威胁说如果得不到钱的话就会在全国范围内和欧洲其他地方继续这样做。警方称，他们发现了一些被乙二醇污染的婴儿食品，这种无色、无味的液体用于制造防冻剂，食用后可能导致死亡。警方补充说，尽管已经逮捕了嫌疑人，但公众在购买食物时仍应警惕篡改迹象。,worldnews,"September 30, 2017 ",1
"马克龙的邀请与库尔德公投无关——伊拉克总理

请注意，由于图片中包含模糊的文字，我无法识别出具体的内容。如果您能提供更清晰的图片或文字信息，我会尽力帮助您进行翻译。",巴格达（路透社）——伊拉克总理海德尔·阿巴迪周六表示，法国总统埃马纽埃尔·马克龙的访问邀请与库尔德独立公投无关。这份邀请于8月26日在巴格达由法国外交和国防部长送达阿巴迪，其办公室在一份声明中称，目的是加强双边关系并集中精力打击恐怖主义。马克龙办公室的一位消息人士称，阿巴迪已接受马克龙的邀请，将于10月5日前往巴黎就库尔德独立公投问题进行会谈。阿巴迪的声明说，阿巴迪和马克龙周一公投后的电话交谈没有提到任何需要承认库尔德人民权利的事宜。,worldnews,"September 30, 2017 ",1
特朗普将于11月访问亚洲，朝鲜成为焦点,华盛顿（路透社）——特朗普将于11月首次以总统身份访问亚洲，他将在日本、韩国、中国、越南和菲律宾停留，此行预计将以朝鲜核威胁为主题。他的妻子梅拉尼娅·特朗普将陪同前往。特朗普将于11月3日至14日进行此次旅行。他将参加在越南举行的亚太经合组织和在菲律宾举行东盟峰会的两个主要峰会。特朗普出席马尼拉峰会的消息直到最近几天才确定下来，官员们表示，他对支持菲律宾总统罗德里戈·杜特尔特持保留态度，后者一直发表反美言论。一位美国官员说，上周在纽约联合国大会与特朗普会面的亚洲领导人帮助说服了他与关键亚洲盟友团结一致。一位亚洲外交官欢迎特朗普决定访问马尼拉，因为这将向该地区表明，亚洲政策不仅仅是关于朝鲜，也是关于东南亚的。这位外交官说，特朗普今年早些时候退出跨太平洋伙伴关系贸易协定引起了人们对美国政府对该地区承诺的质疑。但包括国务卿、国防部长和商务部长在内的高级官员的访问以及特朗普的预定行程表明，华盛顿有意继续参与其中。菲律宾外长艾伦·彼得·凯塔诺说，杜特尔特期待见到特朗普，并补充说两国的关系如此坚不可摧，无论发生什么分歧，联系都会恢复。特朗普与朝鲜领导人金正恩陷入了一场越来越激烈的口水战，他将有机会加强盟国对平壤“全面无核化”的决心。他谴责金正恩是“火箭人”，因试射弹道导弹和进行核武器试验而自杀未遂。他警告说，如果朝鲜威胁到美国，它将面临彻底毁灭。金正恩则抨击特朗普为“精神错乱”。 白宫在宣布此次出访时说：“总统的这些活动将加强国际社会应对朝鲜威胁的决心，确保朝鲜半岛实现完全、可验证和无条件无核化。”特朗普对中国之行将回报4月份中国国家主席习近平对美国进行的访问。特朗普一直在对中国施加巨大压力，要求其遏制朝鲜。尽管到目前为止他的努力成效有限，但他不遗余力地感谢习近平的努力。周二，他在与西班牙首相马里亚诺·拉霍伊的新闻发布会上说：“我赞扬中国断绝了所有与朝鲜的银行业务——两个月前人们甚至认为这是不可能的。我要感谢习主席。” 在北京，美国国务卿雷克斯·蒂勒森告诉中国的最高外交官杨洁篪，两位总统已经建立了“非常常规和密切的工作关系”。杨洁篪称特朗普的访问对双边关系具有重要意义。 他说：“让我们集中精力合作，妥善处理相互尊重和互惠互利的原则。” 同时，特朗普的国家安全团队正在全面审查美国对华战略，寻找反击中国贸易做法和市场准入的方式，一名高级政府官员说。美国还认为，中国企业窃取知识产权和网络攻击，希望找到解决这些问题的方法。这名官员没有给出结束审查的确切时间表。“我们在研究所有这些问题，”这名官员说。,worldnews,"September 29, 2017 ",1
阿富汗什叶派担心阿舒拉节庆祝活动遭到进一步袭击,喀布尔（路透社）——阿富汗首都喀布尔在星期六为可能发生的进一步袭击做好了准备，因为伊斯兰教最神圣的一天——阿舒拉节即将到来。据伊斯兰国宣称，前一天发生的一起袭击事件造成至少五人死在一家大型什叶派清真寺附近。 在周日庆祝活动之前，喀布尔的许多地区都设有额外的警察检查站和路障，而其他城市的安保措施也有所加强。阿富汗这个多数信奉逊尼派的穆斯林国家，传统上不像伊拉克那样遭受宗派暴力的破坏，但近年来的一系列袭击事件却针对了什叶派社区。 我们对此感到担忧。过去我们内部有过战斗，但没有宗教斗争，议会成员、主要是什叶派哈扎拉社区的成员阿里夫·拉曼尼说。 政府为数百名志愿卫兵提供了基本培训和武器，这些卫兵驻守在清真寺和其他集会地点附近，但许多人担心这种保护措施不够充分，因为它只覆盖了这座城市超过400座什叶派清真寺中的部分。 2011年，喀布尔和北部城市马扎里沙里夫的阿舒拉袭击事件中，有80多人被杀，此后又发生了多起袭击事件，包括一个多月前喀布尔一座清真寺发生的自杀式袭击，导致20人死亡。 星期五的袭击发生在卡莱法特胡拉地区的侯赛因亚清真寺外的一条路上，袭击者伪装成牧羊人，虽然并未进入清真寺，但也造成了另外20人受伤，加上已确认的5名遇难者。 没有最新的阿富汗人口普查数据，但不同估计显示，什叶派社区的人口占总人口的10%至20%，大多是波斯语系的塔吉克人和哈扎拉人。 阿舒拉节是穆罕默德先知的一个孙子侯赛因殉难的日子，于公历9月10日举行，什叶派穆斯林会进行大规模的公开纪念活动。总统阿什拉夫·加尼谴责了星期五的袭击事件，并表示这不会打破阿富汗各宗教之间的团结。 但在这个时候，随着国内各种族群体之间的竞争日益公开化，拉曼尼表示，袭击事件的明显目的是加剧紧张局势以制造不稳定。 过去有人警告说，有一些团体想要挑起阿富汗人的种族和宗教冲突，但现在已经成为现实，拉曼尼说。 有一些人想在各民族和宗教团体之间制造分裂，他说。,worldnews,"September 30, 2017 ",1
朝鲜被看到从开发中心移动导弹：韩国广播公司,"首尔（路透社）——据韩国广播系统（KBS）周五晚间报道，最近几枚朝鲜导弹从首都平壤的一个火箭设施被移动出去，这引起了人们猜测朝鲜可能正在准备采取更具挑衅性的行动。报告引用了一位未透露姓名的情报来源称，韩国和美国情报官员发现导弹正被运离朝鲜北部平壤的导弹研究与开发设施Sanum-dong。该报告没有说明它们何时何地被移动。根据报告，这些导弹可能是中程Hwasong-12或洲际弹道Hwasong-14导弹，尽管Sanum-dong的导弹设施一直致力于生产洲际弹道导弹。一位来自韩国国防部的消息人士表示，他无法确认这份报告的细节，也无法证实是否在该地区有异常活动。韩国官员们表达了对朝鲜可能在10月10日其共产主义党成立纪念日或中国于10月18日举行共产党代表大会时采取更多具有挑衅性行动的担忧。    在朝鲜半岛紧张局势加剧之际，韩国和美国军队近期在南韩举行了首次联合短程防空训练演习，美国太平洋司令部周五发布的一份声明中提到这一点。声明没有给出演习日期，但表示下一次演习将在未来几个月内进行，随着两支力量对彼此的能力更加熟悉。

",worldnews,"September 30, 2017 ",1
"据该党称，恐惧正在迫使柬埔寨反对派国会议员出国。

（请注意，由于您没有提供具体的背景信息或上下文，我无法确定“party”指的是哪个政党。如果您能提供更多信息，我可以更准确地回答这个问题。）",金边（路透社）- 柬埔寨议会反对派成员中大约有一半已经离开该国，担心首相洪森政府会对其进行镇压，该党副领导人说。柬埔寨救国党（CNRP）领导人凯姆·索哈于9月3日被捕，被指控与美国合谋发动政变企图叛国。政府表示可能会有更多与该阴谋有关的逮捕行动，而反对派则称这只是确保洪森在明年大选前继续掌权三十三年的伎俩。洪森领导的柬埔寨人民党（CPP）在123人组成的议会中仅占微弱多数，该会在9月11日投票允许起诉凯姆·索哈，但反对派成员抵制了这次投票。凯姆·索哈的三名副手之一穆苏查告诉路透社，大约一半的人已经离开了这个国家，他们感到害怕。我正在冒险。我们不能生活在恐惧之中，让恐惧束缚我们。她说，该党仍在联系那些在国外的人，因为反对派正试图在国际上施压政府。执政党的发言人表示，如果其成员出国是内部问题的话。CPP发言人索埃山说，该党相信对话的文化，但凯姆·索哈的犯罪行为破坏了它。船已离港，所以太晚了，索埃山说。政府表示，如果CNRP不将其领袖凯姆·索哈撤换掉，那么他的政党可能会被解散，而CNRP表示不会这样做。虽然西方国家谴责了凯姆·索哈的被捕并要求释放他，但洪森得到了他亲密盟友中国的大力支持，中国是东南亚最贫穷的国家之一的最大援助国。穆苏查说，她仍然希望西方国家会对政府采取更强有力的行动，但没有具体说明。她说：“仅仅发表声明是无济于事的。”目前对凯姆·索哈提出的证据是一段2013年的视频，视频中他告诉支持者，他得到了未知的美国人的支持来实施一项夺取权力的计划。反对派认为这是选举策略的证据，而不是政变的阴谋。,worldnews,"September 30, 2017 ",1
"China's Xi says study capitalism, but Marxism remains top","BEIJING (Reuters) - Communist Party members should study contemporary capitalism but must never deviate from Marxism, Chinese President Xi Jinping said, offering a clear signal there will be no weakening of party control weeks ahead of a key Congress opening. The party brooks no challenge to its rule, and Xi has overseen a sweeping crackdown on civil society since assuming power almost five years ago, tightening the party s grip over the internet, media and security infrastructure, and locking up rights lawyers and dissidents. Speaking at a study session of the Politburo, one of the party s elite ruling bodies, Xi said that while times are changing and society is developing, the basic tenets of Marxism remain true, state news agency Xinhua said late Friday.  If we deviate from or abandon Marxism, our party would lose its soul and direction,  Xi said.  On the fundamental issue of upholding the guiding role of Marxism, we must maintain unswerving resolve, never wavering at any time or under any circumstances.  Xi said the party should better integrate the basic tenets of Marxism with the  reality of contemporary China and learn from the achievements of other civilizations to create and develop Marxism , Xinhua said.  Xi also asked Party members to study contemporary capitalism, its essence and patterns,  the report added, without elaborating. China has transformed its economy since it began landmark reforms in the late 1970s, and is now the world s second-largest economy. Private firms are now supported and encouraged, but the state-owned sector remains a major driver of growth and investment, though some industries like iron and steel are suffering from worryingly high levels of over-capacity. Xi said the party must continuously develop socialism with Chinese characteristics, continuously enhance China s comprehensive national strength and fully demonstrate the advantages of China s socialist system. Next month s party Congress, which opens on Oct. 18, will see Xi further cement his grip on power and usher in a new generation of senior leaders. ",worldnews,"September 30, 2017 ",1
