title,text,subject,date,label
德国社会民主党在激情澎湃的欧洲演讲后支持与默克尔会谈,柏林（路透社）——德国社会民主党（SPD）星期四投票决定与总理安格拉·默克尔领导的保守党举行会谈，以组建政府。该党的领导人恳切呼吁获得自由，以便为建立一个“自由的欧洲合众国”而努力工作。投票为可能解决欧洲经济强国陷入僵局的谈判铺平了道路，此前默克尔和SPD在九月的选举中失去了支持，大大增加了议会算术的复杂性。舒尔茨敦促不愿合作的中间左翼SPD成员对默克尔的提议持开放态度，以重新组建过去四年执政的联盟，称该党有责任在德国复兴社会民主主义。与不太情愿的SPD组成新的“大联盟”是默克尔在与两个较小政党进行谈判失败后延长其12年权力的最佳希望，使较小的SPD在谈判中获得更大的影响力。“问题不是‘大联盟’或‘没有大联盟’，而是在于我们如何履行我们的责任，包括对下一代的责任。”他在向该党双年度大会发表的演讲中说。舒尔茨说，只有当该党能够提出一个清晰的前景时，它才能恢复过来，即一个为他们的公民服务的德国和一个为他们的公民服务的欧洲，他呼吁更深入地实现欧洲一体化，并在2025年前建立“自由的欧洲合众国”。他说：“欧洲并不总是为人民服务，相反，它往往是为大型公司服务的。”他概述了一种超越默克尔有限的结构改革和官僚简化开放性的民粹主义愿景。预计两党之间的谈判将在新的一年里正式开始。将召开特别会议，届时党成员将对是否支持一项最终协议进行投票，这项协议可能不构成正式联盟，并可能包括容忍少数派政府。下萨克森州有影响力的州长斯特凡·威尔（Stephan Weil）表示，为了支持任何政府，SPD都希望看到自己的政策得到体现。“我认为大多数代表把自己视为欧洲政党，他们期望德国再次成为欧盟的推动力量，”他对舒尔茨关于欧盟的建议如是说。默克尔对舒尔茨的建议则更为谨慎。“现在应该把欧盟的行动能力放在首位，”她在柏林的一次新闻发布会上说。“因此，我将专注于到2025年在国防方面加强合作以及其他问题，包括就业和创新。”在国会大厦外，许多希望该党在过去的12年中花费8年时间参与中间偏右的联合政府之后制定独特路线的SPD青年活动家分发红色卡片，上面写着“反对大联盟”。一位发言人在会议上说：“默克尔在这个国家领导无方。”“她没有欧洲计划，她每周都在领导这个国家。我们需要这个国家的强大社会民主主义。”舒尔茨最初表示，他的党应该在默克尔领导下参加前一次大联盟而受到惩罚后进入反对派。他为该党灾难性的选举结果道歉。舒尔茨抨击欧洲支持大型银行而对高失业率几乎无所作为的做法。“当一个国家无法平衡预算时，它会面临来自布鲁塞尔的严厉制裁。如果我们能动员数十亿资金来救助银行，但却要为年轻人就业争取微不足道的资金，那么这绝对不是我想要的欧洲。”他的语气比法国总统埃马纽埃尔·马克龙更加批判，后者正在推动更深层次的欧元区一体化和在欧元区财政部长下的亲商改革。“我们需要强大的欧洲来让苹果、脸书和谷歌遵守规则和保护不断变化的经济发展中的工人权益。”他以掌声回应道，“我们不想要由应用程序驱动的服务社会，但我们要数字化的进步带来更多的个人自由。”在移民问题上，这是导致默克尔第一次尝试组建联盟崩溃的主要原因之一，SPD反对保守党的一项计划，该计划旨在扩大禁止某些被接受的寻求庇护者的权利的范围。舒尔茨告诉与会者：“战争和迫害的保护权不能有任何上限。”他拒绝了保守党要求每年移民人数上限为20万的要求。,worldnews,"December 6, 2017 ",1
"真主党敦促巴勒斯坦人反对特朗普关于耶路撒冷的决策而起义

（请注意，由于图片模糊，无法识别出具体的内容，以上内容仅供参考）","BEIRUT（路透社）——黎巴嫩的真主党于周四呼吁对美国的耶路撒冷决定进行新的巴勒斯坦起义。什叶派穆斯林政治和军事运动的领导人萨伊德·哈桑·纳斯拉拉在电视演讲中说，美国总统唐纳德·特朗普的决定是对阿拉伯和伊斯兰世界的“公然侵略”。该地区及更远的国家警告说，特朗普颠覆几十年来美国关于耶路撒冷的立场将会危及中东和平努力。巴勒斯坦各派别呼吁周五举行“愤怒日”，伊斯兰组织哈马斯敦促巴勒斯坦人放弃谈判，对以色列发动新一轮起义。纳斯拉拉表示支持“新的大规模起义”并要求抵抗升级。“这是对美国决定的最大的、最重要的也是最严重的回应。”纳斯拉拉称特朗普的行动是“重大历史性不公正”，没有详细说明真主党会采取什么直接行动。他呼吁在贝鲁特的南部郊区周一举行大规模抗议活动。他还补充道：“今天，巴勒斯坦人民站在保卫耶路撒冷及其圣地的前沿。”

伊朗支持的真主党，以色列认为它是边境的最大威胁，据纳斯拉拉上个月所说，它之前曾向巴勒斯坦领土输送武器。真主党和以色列在2006年爆发战争，导致约1200名黎巴嫩人死亡，其中大多是平民，以及160名以色列人，大多数是军人。自从那场持续一个月的战斗以来，双方一直避免发生重大冲突，尽管今年早些时候紧张局势有所上升。

纳斯拉拉呼吁该地区的听众对抗美国的举动，并与巴勒斯坦人团结一致。他呼吁阿拉伯国家切断与以色列的一切外交关系，并召回他们的美国大使以正式抗议。他说，“这样的举措肯定会让特朗普后悔。”耶路撒冷——拥有犹太教、基督教和伊斯兰教圣地的城市——代表了以色列人和巴勒斯坦人之间和平协议的一个最大障碍。国际社会并不承认整个城市的以色列主权。根据1993年由美国斡旋达成的奥斯陆协议，应该通过谈判决定该市的地位。没有其他国家把大使馆设在耶路撒冷。真主党的议会集团此前表示，特朗普的决定将产生“灾难性的后果，威胁到区域和国际安全与稳定”。

",worldnews,"December 7, 2017 ",1
津巴布韦法官释放被罢免财政部长保释出狱,哈拉雷（路透社）——津巴布韦法官周四以保释释放被罢黜的财政部长伊格纳修斯·丘博，这一裁决凸显了司法独立，就在军队帮助推翻罗伯特·穆加贝三周后。丘博是执政党G40派系的高级成员，该派系在11月15日军事干预中被目标，他在午夜时分从家中被拖走，在一处未透露地点被士兵软禁了一周。据他的律师称，在此期间他遭到殴打。在被释放时，他被警方逮捕并指控欺诈和滥用职权，与十多年前担任政府部长有关。哈拉雷地方法院拒绝了他的保释申请。然而，高等法院法官埃迪丝·姆舒雷谴责该判决“充斥着误导性言论”和“涉足公众舆论的泥潭”，这是在军队支持的抗议活动推翻穆加贝上台37年后发生的。65岁的丘博被命令以5000美元的保释金获释，交出护照和他位于哈拉雷的豪宅产权证，并在首都警察局每天报到三次。穆舒雷的裁决的语气和实质也向支持总统埃默森·姆南加古瓦的军方背景的政权发出了严厉的信息，关于法院的独立性以及法律的主导地位，这些方面往往被穆加贝忽视。在军事拘留期间，丘博被剥夺了宪法赋予的基本权利，如获得正义和无罪推定的权利，穆舒雷说。特别是她说，津巴布韦人需要知道他们可以在晚上睡觉而不必担心在秘密地点被任意拘禁，而律师或家人无法触及——这是由穆加贝领导的警察国家的常见特征。“津巴布韦人民需要知道他们有权获得正义，”她说。丘博是几名在军事行动“恢复遗产”中关押的G40人物之一，该行动正式启动旨在清除穆加贝周围的“罪犯”。大多数津巴布韦人认为这意味着穆加贝52岁的妻子格雷斯，她正在取代93岁的丈夫的位置，而将姆南加古瓦排除在外，后者早在11月初就被清洗出执政党。丘博的律师表示，他将否认即将开始的审判中的指控。在粗略分析中，穆舒雷将国家对他的指控描述为“纯粹的指控”。,worldnews,"December 7, 2017 ",1
阿尔巴尼亚通过税收优惠吸引高端酒店品牌,地拉那（路透社）——阿尔巴尼亚计划通过取消利润税和财产税等税收优惠措施来吸引五星级酒店品牌，以提高其高端旅游市场的吸引力。随着旅游业占国内生产总值的比重在2016年达到8.4%，来自黑海和爱奥尼亚海的科索沃和希腊之间的旅行需求增长并未得到现有设施和基础设施的支持。作为欧洲最贫穷但也是最未受破坏的国家之一，阿尔巴尼亚一直鼓励游客“按自己的方式行事”，寄希望于冒险旅游的魅力。现在，为了吸引国际酒店品牌，政府将于本月通过一项法律，豁免这些酒店十年内缴纳所得税，取消基础设施税和财产税，并要求他们为其酒店或度假村的任何服务支付6%的增值税。旅游部官员埃尔顿·奥罗齐说：“只要投资不少于800万欧元开设四星级酒店，或者投资不少于1500万欧元开设五星级酒店，国际酒店连锁或拥有它们的特许经营权的任何人都可以加入。”奥罗齐补充道，“阿尔巴尼亚正试图向那些愿意花更多时间和金钱了解当地文化、历史和自然的游客提供更多的东西”。只有在开发商不销售单位的情况下，这些激励措施才会适用，因为政府不想让富有的阿尔巴尼亚人建造别墅用于第二居所。建设豪华酒店还取决于投资者是否避开土地所有权问题，这些问题使法国Club Med度假公司十多年前试图进入阿尔巴尼亚的努力以失败告终。,worldnews,"December 7, 2017 ",1
德国社会民主党投票支持与默克尔保守派进行谈判,柏林（路透社）- 德国社会民主党（SPD）成员于周四以压倒性多数投票决定允许其党领导层与总理安格拉·默克尔（Angela Merkel）领导的保守派进行谈判，组建政府。党的代表大会的投票意味着领导人可以讨论包括重新组建大联盟、非正式合作或正式同意容忍由不否决某些议会动议而形成的少数党政府的选项。,worldnews,"December 7, 2017 ",1
埃尔多安和普京表示，美国关于耶路撒冷的决定将对地区产生负面影响：消息来源,安卡拉（路透社）- 据埃尔多安办公室的消息人士称，土耳其总统雷杰普·塔伊普·埃尔多安和俄罗斯总统弗拉基米尔·普京在周四的电话交谈中同意美国关于耶路撒冷的决定将对该地区的和平与稳定产生负面影响。 埃尔多安强调，美国政府最近的行动会对该地区的和平与稳定产生负面影响。消息来源表示，普京也表示他持有相同的观点。  在周四早些时候，据土耳其总统府消息人士透露，埃尔多安教皇方济各在电话交谈中表示任何试图改变耶路撒冷地位的企图都应避免，因为美国总统唐纳德·特朗普周三逆转了几十年来美国的政策，并承认耶路撒冷是以色列的首都。,worldnews,"December 7, 2017 ",1
联合国将评估双方是否试图“破坏”叙利亚谈判,日内瓦（路透社）——负责联合国主导的叙利亚日内瓦和平谈判的中调人表示，他将于下周评估双方是否试图破坏这一进程。他说：“我们将评估政府和反对派在日内瓦的行为。” 联合国特使斯塔夫安·德米斯图拉说，“根据这些情况，我们将决定这……可以是日内瓦的加强或不是，或者是对日内瓦的破坏。” 他说，如果任何一方被认为是在破坏这一进程，它可能会对其他地方的政治尝试产生非常不利的影响。 他表示，日内瓦会谈是唯一得到联合国安全理事会支持的和平进程，尽管还有许多其他倡议正在计划中。他没有详细说明，但俄罗斯总统弗拉基米尔·普京明年寻求连任，他建议在俄罗斯索契市于2018年初举行“叙利亚国会”。外交官认为普京的计划是为了划上战争结束的句号，并在七年战斗后庆祝俄罗斯作为战争平衡的关键力量和成为和平进程关键参与者的角色。反对派谈判代表巴斯玛·科德曼尼告诉记者，政府方面浪费了一个星期的直接谈判机会，而反对派则尽了一切努力。 “我认为我们通过我们的存在、行为以及提交给联合国的文件数量表明，我们在与联合国进行非常有建设性的互动，而且到目前为止我们没有可以与之交谈的伙伴，”她说。“他们不在那里。由首席谈判官巴沙尔·贾法里领导的政府代表团缺席实际上已经使一个进展甚微的和平进程停滞了八轮。最新一轮会谈上周开始，德米斯图拉希望讨论包括宪法和选举改革在内的议程。 但贾法里迟到一天，只呆了两天就离开了，称反对派坚持认为阿萨德不能在叙利亚政治过渡期间发挥任何作用，从而破坏了通往会谈的道路。 代表团返回大马士革进行“咨询和更新”，但贾法里最初威胁说不回来，这让反对派说这将是对俄罗斯的“羞辱”。 德米斯图拉周四表示，贾法里的代表团已确认将于周日返回，比预期晚了五天，并将继续谈判至12月15日。,worldnews,"December 7, 2017 ",1
埃尔多安、教皇在电话中说应避免改变耶路撒冷地位：土耳其消息来源,"安卡拉（路透社）- 据埃尔多安办公室的消息人士称，土耳其总统雷杰普·塔伊普·埃尔多安和教宗方济各在周四的电话交谈中同意避免任何改变耶路撒冷地位的努力。消息来源强调，耶路撒冷对犹太人、基督徒和穆斯林都是神圣的，埃尔多安总统和教宗方济各表示，应该避免任何试图改变该城市地位的企图。

周三，美国总统唐纳德·特朗普推翻了几十年的美国政策，承认耶路撒冷是以色列的首都。",worldnews,"December 7, 2017 ",1
陆军司令说巴基斯坦应该“重新考虑”伊斯兰教经文学校,巴基斯坦陆军参谋长周四批评了全国范围内大量涌现的宗教学校，称这些学校大多只教授伊斯兰神学，该国需要重新审视宗教学校的概念。现代化宗教教育在巴基斯坦是个棘手问题，这个国家深受保守主义影响，宗教学校往往被指责导致年轻人极端化，但却是数百万贫困儿童的唯一教育途径。巴杰瓦将军的评论似乎是在一次准备好的演讲中即兴发表的，是陆军参谋长公开批评宗教学校的罕见例子。这些宗教学校通常建在清真寺附近，是宗教强硬派推动伊斯兰化的支柱。巴杰瓦说，巴基斯坦的宗教学校教育不足，因为它们没有让学生为现代社会做好准备。“我并不反对宗教学校，但我们已经失去了宗教学校的本质。”巴杰瓦在俾路支省首府奎达的一次青年会议上表示。巴杰瓦说，他最近听说有250万学生在接受德奥班迪教派的宗教教育，该教派与阿拉伯半岛上严格正统的瓦哈比学派信仰相同。“那么他们会成为什么？会成为毛拉（教士）还是恐怖分子？”巴杰瓦问道，并表示不可能建造足够的清真寺来容纳如此庞大的宗教学校学生人数。“我们需要审视并重新考虑宗教学校的概念……我们需要给予他们世俗教育。”巴基斯坦有超过2万家注册宗教学校，尽管据信还有数千家未注册的学校。有些只是单间教室的学校，只有少数学生学习古兰经。安全部门一直在密切关注那些与激进化青少年和向伊斯兰武装组织输送兵员有关的宗教学校，自2000年以来，这些组织在南亚这个国家杀害了成千上万的人。但只有少数几所学校被关闭，当局因担心引发宗教反弹而停下了脚步。伊斯兰教强硬派在社会中影响力巨大，首都伊斯兰堡上月几乎被一个新成立的极宗教政党封锁了近三周。巴杰瓦说，糟糕的教育阻碍了这个拥有2.07亿人口的国家的发展，尤其是在宗教学校。他说：“大多数宗教学校只是在教授神学。他们的机会有多大？他们在这个国家的未来是什么样子？”军方去年提出了一项计划，通过让一些宗教强硬派进入政界来“主流化”他们以去极端化，这一计划最初遭到民政府拒绝，但现在看来似乎正在形成。,worldnews,"December 7, 2017 ",1
"德国选民因FDP领导人退出联盟而惩罚其：调查

请注意，由于“coalition”一词在政治语境中通常指的是“联盟”，因此我将其翻译为了“联盟”。如果需要更精确的政治术语，可以进一步讨论和调整。",BERLIN（路透社）——德国选民正在惩罚自由民主党（FDP），因为该党上个月退出三方联合谈判。周四的一项调查显示，该党的支持率下降，其领导人克里斯蒂安·林德纳的人气暴跌。11月中旬，FDP放弃了与总理默克尔保守派和环保主义者绿党的联盟政府的初步谈判。当时，林德纳表示，与其错误地治理，不如不治理。一些观察人士猜测，FDP早就计划好了这一行动，以提高其在选民中的地位，并表明该党把政策原则放在权力之前。但由Infratest Dimap民意调查机构为ARD公共广播公司进行的每月“DeutschlandTrend”调查显示，FDP的支持率下降了3个百分点至9%，使其成为议会中最小的政党。默克尔的保守派增加了2个百分点至32%，社会民主党（SPD）保持在21%不变。右翼民粹主义政党“德国另选择”得分为13%，其次是绿党11分，左派10分。FDP领袖林德纳的人气暴跌了17个百分点，只有28%。默克尔的人气下降了3个百分点，降至54%，这是自2016年10月以来她在调查中获得的最低得分。德国最受欢迎的政治家名单榜首是SPD外交部长西格马尔·加布里埃尔，他上升了8个百分点至65%。绿党共同主席塞姆·奥泽丹米尔以57%的支持率位居第二。,worldnews,"December 7, 2017 ",1
真主党呼吁新的巴勒斯坦起义，“抵抗”升级,BEIRUT（路透社）——强大的黎巴嫩组织真主党周四表示，它支持呼吁新的巴勒斯坦起义以回应美国决定承认耶路撒冷是以色列首都的行动，并敦促支持抵抗这一行动。 真主党领导人萨伊德·哈桑·纳斯拉拉在电视演讲中表示：“我们支持呼吁新的巴勒斯坦起义和加剧抵抗，这是对美国的决定最大的、最重要的也是最严重的回应。”,worldnews,"December 7, 2017 ",1
南非警方传唤批评祖马的书作者,约翰内斯堡（路透社）- 一位南非作家周四表示，他已被警方传唤，但未说明会面的原因。记者雅克·普乌（Jacques Pauw）撰写的《总统守护者——那些让祖马掌权并使其免于入狱的人》一书指控数百万美元的纳税人资金流入间谍和祖马政府的成员银行账户。总统办公室否认了该书中的指控。普乌在eNCA电视台的一次采访中确认，他的律师已收到要求他在周一或周二与警方会面的请求。“我们不知道这次会议是关于什么的。无论如何，我们会合作的，”普乌说。上个月，南非国家安全局表示，它已对普乌提起刑事投诉，涉及违反《情报服务法》的多个条款。,worldnews,"December 7, 2017 ",1
乌克兰是俄罗斯正常关系的主要障碍，蒂勒森说,"维也纳（路透社）——美国国务卿雷克斯·蒂勒森周四表示，美国非常希望解除对俄罗斯的制裁，但只有在莫斯科从乌克兰东部和克里米亚撤出其军队后才会这样做，称这是正常关系的主要障碍。蒂勒森正在欧洲访问，期间他通过比美国总统唐纳德·特朗普更加强硬的言论向盟友保证，后者寻求与俄罗斯总统弗拉基米尔·普京建立更好的关系。在参加欧洲安全与合作组织（OSCE）会议时，他的俄罗斯同行也在场，蒂勒森说，莫斯科应对东乌克兰局势加剧的暴力负责，这种情况必须停止。“从一开始我们就明确告知俄罗斯，我们必须解决乌克兰问题，”蒂勒森在与奥地利外交部长塞巴斯蒂安·库尔茨举行的新闻发布会上说。“它是我们重新与俄罗斯恢复正常关系的唯一最困难障碍，我们非常希望能够做到这一点。”周三，蒂勒森会见了北约外长并批评了俄罗斯，因为北约盟国情报机构称，俄罗斯混合使用国家资助的黑客和网络虚假信息活动，目标直指西方。自2014年爆发冲突以来，乌克兰军队和亲俄分离主义武装之间的冲突已造成1万多人死亡。俄罗斯否认煽动冲突并提供武器和战斗人员。俄罗斯外交部长谢尔盖·拉夫罗夫在OSCE会议上说，就东部地区的暴力而言，“所有的责任都在乌克兰”。在向与会者发表的讲话中，蒂勒森比前一天在布鲁塞尔所做的那样更加详细地阐述了俄罗斯在该冲突中的参与及其后果。“我们应该清楚这种暴力的来源，”蒂勒森说，他提到了由OSCE观察员记录的在东乌克兰不断增加的停火违反情况。“俄罗斯正在装备、领导、培训并在反政府部队方面并肩作战。我们呼吁俄罗斯及其代理人结束对OSCE特别监察团的骚扰、恐吓和攻击。”虽然双方都要求在乌克兰东部部署联合国维和部队，但他们不同意部署条件，周四的会议也没有显示出取得实质性进展的迹象。“我们将继续与俄罗斯合作，看看我们是否能达成一项协议，派遣一支能够进入乌克兰（并减少暴力）的维和部队，”蒂勒森在新闻发布会上说。他在会议边缘与拉夫罗夫会面，但在会议开始时两人都无视记者提问。被问及在会上获得了什么承诺时，蒂勒森说：“我不会告诉你具体得到了什么。我们取得了进展，这就是我们所取得的。我们有对话，有合作，但我们还没有解决问题。一次会议不可能解决问题。”在他的演讲中，他还提到了2015年的明斯克停火协议，该协议是在白俄罗斯首都由法国、德国、俄罗斯和乌克兰共同斡旋达成的。“在东乌克兰，我们与我们的欧洲伙伴一起维持对俄罗斯的制裁，直到俄罗斯从顿巴斯地区撤军并履行明斯克承诺，”蒂勒森说。他还表明华盛顿不接受俄罗斯于2014年从乌克兰手中夺取的克里米亚半岛。“我们永远不会接受俄罗斯占领并试图吞并克里米亚。克里米亚相关的制裁将持续到俄罗斯完全控制该半岛归还给乌克兰，”他说。

",worldnews,"December 7, 2017 ",1
拉夫罗夫：美国对俄罗斯外交官和媒体的施压是不可接受的,莫斯科（路透社）——俄罗斯外交部长谢尔盖·拉夫罗夫周四表示，美国对俄罗斯外交官和媒体的施压是不可接受的。俄罗斯外交部在一份声明中称，这包括美国情报机构试图招募人员的行为。拉夫罗夫在与蒂勒森会晤时说，该会晤是在维也纳的一次会议上举行的。,worldnews,"December 7, 2017 ",1
以色列警报应用程序称，火箭弹在靠近加沙地带的方向上发射到以色列境内。,耶路撒冷（路透社）——周四，以色列警报电话应用程序响起，火箭弹在加沙地带附近的不同地点袭击了以色列，但军方尚未确认任何击中以色列的情况。警报响起的一天是紧张局势加剧的一天，此前巴勒斯坦人在周三美国总统唐纳德·特朗普宣布承认耶路撒冷是以色列首都后，在占领的西岸和加沙地带举行了抗议活动。,worldnews,"December 7, 2017 ",1
"关于特朗普关于耶路撒冷的行动，默克尔表示德国坚持联合国决议。

（请注意，由于图片模糊无法识别出具体的内容，以上内容仅供参考）",柏林（路透社）- 联邦总理安格拉·默克尔周四表示，在美国总统唐纳德·特朗普决定承认耶路撒冷是以色列首都后，德国将继续支持联合国关于巴以冲突的决议。“我们坚持相关联合国决议——这些决议明确指出，耶路撒冷的地位需要在以色列和巴勒斯坦两国解决方案谈判中协商解决，这就是为什么我们要让这一进程恢复的原因，”她说。周三，默克尔已经表示德国不支持特朗普政府的决定。,worldnews,"December 7, 2017 ",1
