title,text,subject,date,label
以色列缩短了杀害俯卧袭击者的士兵刑期,耶路撒冷（路透社）——以色列军方周三将一名前士兵因枪杀受伤的巴勒斯坦袭击者而被判的18个月监禁减刑4个月，称他的服役记录值得宽恕，尽管他在案件中没有表现出悔意。2015年3月，步兵征兵人员Elor Azaria被拍摄到在约旦河西岸希伯伦市对其他以色列士兵进行刺伤攻击后躺在地上受伤的巴勒斯坦人Abd Elfatah Ashareef开枪打死。Azaria说，他开枪打死了Ashareef是因为他担心这名巴勒斯坦人可能会发动另一场袭击，但军事法庭发现证词存在矛盾，并判处他过失杀人罪。判决在上诉中被维持。在被军队解职后，Azaria上个月入狱，并向武装部队总司令加迪·艾森科特中将呼吁重新考虑他的判决，引用了这场充满争议的审判给他的家庭带来的高昂代价。周三公布的信件中，军方通知Azaria，艾森科特将军决定根据同情和仁慈的原则缩短监禁期限……考虑到你在作战地区作为战斗士兵的过去。但这封信也批评了这位前士兵没有对自己的严重行为负责，也没有为此表示遗憾，补充道“法院裁决中的重要信息应该得到重视”。Azaria成为了以色列右翼的偶像，大多数犹太男女都在18岁时应征入伍。一项民意调查发现，近半数的以色列犹太人认为任何巴勒斯坦袭击者都应该当场被击毙。巴勒斯坦政府表示，Azaria的监禁期给了以色列士兵“绿灯”来肆意杀人。根据以色列法律，过失杀人最高可判处20年监禁。军事检察官曾要求上诉法院对Azaria处以三至五年的监禁，但这一请求被拒绝了。,worldnews,"September 27, 2017 ",1
乌克兰数千人因弹药库爆炸被疏散,基辅（路透社）-乌克兰中部一个军事弹药库发生大规模爆炸和火灾，迫使当局疏散了2.4万人并关闭了该地区的空域，官员周三表示。乌紧急服务部门在一份声明中说，周二晚上在距离基辅西边270公里（168英里）的文尼察地区卡利尼夫卡附近的一个军事基地发生了爆炸。一人受伤。几小时后抵达该地区的总理沃洛迪米尔·格罗伊斯曼说，外部因素导致了这一事件。,worldnews,"September 27, 2017 ",1
在日本，新党用民粹主义口号挑战安倍；但政策差异不大,"东京（路透社）——由东京都知事小池百合子领导的新的政党正在提出一些民粹主义的口号，如结束核能和冻结消费税上调，以迎接下个月即将举行的选举，但选民可能发现与执政的自民党（LDP）之间并没有多少其他重大政策分歧。小池百合子的“希望之党”于周三正式成立，并发布了一段宣传视频和新闻稿。该党可能会吸引那些认为首相安倍晋三在近五年任期内变得自满甚至傲慢的选民。新党的加入增加了选举的不确定性。尽管自民党领导的联盟不太可能失去对权力的掌控，但如果表现不佳，将会削弱安倍的声望，使政策倡议变得更加困难，并危及他成为日本最长期总理的希望。“小池所在的党和自民党之间没有太大的区别，”纽约哥伦比亚大学名誉教授Gerry Curtis说，“问题是谁能给选民留下更深刻的印象。这是能力和性格。”希望之党在政策和商业友好的保守派自民党以及主要反对党民主党右翼的政策空间上都有重叠，后者经常是保守派和自由派的分裂组合。民主党正面临着向新党流失党员和支持率个位数的困境。当被问及媒体有关她讨论与民主党合并或合作的报道时，小池告诉公共广播公司NHK说她对此不感兴趣。“我欢迎与我们政策相同的人的个人参与，而不是党与党之间的合作，”她说，并补充说她的党已经收到了许多潜在候选人的邀请。一些政治分析师建议，鉴于其政策的相似性，小池可能在选举后选择与自民党结盟。安倍承诺要采取强有力的领导来应对日本快速老龄化和朝鲜日益增长的威胁，他打赌自民党和其次要的联合伙伴能够在议会下议院继续保持多数席位，他们在那里拥有三分之二的优势。他将于周四解散下议院，预计将于10月22日进行投票。这位63岁的总理于2012年12月重返权力，提出了加强日本的防御、重启通货紧缩的经济等承诺，并通过超宽松的货币政策、支出和改革来实现这一目标。他将修订战后和平宪法作为其长期议程的关键一环。小池65岁，曾在安倍2006年至2007年的第一届内阁中担任防卫大臣，但她去年成功竞选东京知事后违背了自民党的意愿，并于今年7月在东京地方议会选举中以历史性的胜利击败了自民党。这位媒体老手——曾被视为将成为日本首位女总理的有力人选——正试图在全国范围内复制这一成功。然而，周三，她表示自己不会参加这次议会的竞选。周三发布的模糊不清的希望之党平台承诺成为一个“宽容、保守的改革党”，摆脱既得利益，保护公众，明智地使用税收资金，尊重多样性。然而，小池已经在两个可能与选民共鸣的问题上与自民党拉开了距离。她建议将销售税率从目前的8%提高到2019年的10%，并呼吁停止使用核能——但没有说明如何以及何时实现。后者引发了人们猜测小池可能会赢得曾经受欢迎的前首相小泉纯一郎的支持，他主张立即停止使用原子能。相比之下，安倍表示将继续提高税率，但他计划将部分收入用于儿童和教育，而不是偿还公共债务。尽管如此，他的政府仍计划将核电作为一个基本能源来源，尽管在2011年福岛核危机之后引起了公众的关注。小池批评了安倍的“安倍经济学”增长政策，称它未能让人民感到高兴，但她没有详细说明她会怎么做，除了加快改革。安倍和小池都在安全政策上持强硬立场，虽然她最近说得不多，但承诺要根据和平主义制定实用的外交和安全政策。她表示，修改战后宪法的辩论是不可避免的，但不应该仅限于有争议的修改和平主义第九条的议题，而安倍则希望改变这一点，以澄清军队的地位。承诺改革“既得利益的政客”和结束幕后交易往往在日本选民中产生共鸣，他们定期渴望从统治日本长达六十多年的自民党中寻求变革。

",worldnews,"September 27, 2017 ",1
"乌干达议会就任期限制法进行第二天争论

立法者们在乌干达议会就任期限制法进行了第二天的争论。",坎帕拉（路透社）——周三，乌干达议会连续第二天爆发冲突，原因是有人计划修改法律以延长总统约韦里·穆塞韦尼在东非国家的统治时间，一位路透社目击者说。反对这一行动的一些国会议员也在周二被议长丽贝卡·卡达加因行为不端而暂停议会职务后，被粗暴对待并逐出议会大厅。,worldnews,"September 27, 2017 ",1
"欧盟委员会表示，在危机期间可能扩大边境管制。

**翻译：**

欧盟边境控制可能在危机期间得到扩展，欧盟委员会表示。","布鲁塞尔（路透社）——欧盟委员会周三提议，在危机期间，欧盟自由旅行区内的临时边境控制可以延长多达三年，以给其更多空间遏制移民潮。欧盟执行机构的这一提案正值德国、奥地利、丹麦和挪威的边境控制即将到期之际，这是欧盟对2015年11月难民和移民激增作出回应的一部分，当时的情况考验了欧盟关于免签旅行的规则。根据欧盟设定的两年期限，这些国家必须在今年11月前取消边境检查。所谓的申根地区以卢森堡的一个城镇命名，旨在成为该集团内自由流动的象征。

虽然并未提及这四个国家，但若得到欧盟政府的同意，欧盟委员会的计划将允许它们继续实施边境控制一年，前提是能够证明其必要性。欧盟内政事务专员迪米特里奥斯·阿夫拉莫普洛斯表示，通过希腊和西巴尔干地区的移民威胁不再是进行边境检查的正当理由。“从11月起，与来自东地中海的人有关的内部边境控制将不再可能，”他在一次新闻发布会上说。“所有成员国都有可能在面临其他对其国内安全的威胁时引入内部边境控制，”他强调这些措施必须保持例外性。

德国长期以来一直认为需要采取这些措施来应对欧洲伊斯兰极端主义的威胁。自2014年以来，欧盟已接收170多万中东和非洲难民。但在2015年大规模涌入后，随着2016年关闭土耳其通往希腊的路线，人数稳步下降。欧盟还加强了支持利比亚的工作，以减少抵达意大利的人数。瑞典取消了边境检查，但加强了对内部的监控。挪威是申根协议的一部分，但不是欧盟成员。",worldnews,"September 27, 2017 ",1
南非法院要求政党公开资助者信息,约翰内斯堡（路透社）——南非法院周三裁定，该国政党应被要求披露其资金来源，这可能暴露出在种族隔离结束以来的二十年中影响权力的赞助网络。西开普高等法院的这一裁决要求议会修改信息获取法，这一决定遭到了一些政党的反对，这些政党担心公开可能会危及资金来源。法官亚斯敏·迈尔在法庭文件中表示，披露政治党和独立候选人的私人资金对于有效行使选举权和进行政治选择是必要的。她指示议会相应地修订《促进获取信息法案》（PAIA）。非营利组织“我的选票计数”（My Vote Counts，简称MVC）提出了挑战PAIA合宪性的申请，该组织豁免了党派资金的PAIA，并欢迎这一判决。MVC在一项声明中说：“这意味着必须有一个立法机制来允许访问这些信息。”然而，一位分析师表示，这可能会对资金产生影响，并有可能使政党陷入尴尬境地。“存在巨大的尴尬风险。我认为你会发现有些人似乎强烈支持一个政党，但实际上他们给另一个政党提供了资金，”NKC研究公司的政治分析师加里·范斯特丹说。主要反对党民主党（Democratic Alliance）是回应政党的其中之一，并表示一些捐赠者不愿意公开，以免受到歧视。同样作为回应者的执政党非洲人国民大会（African National Congress）尚未对此作出评论。,worldnews,"September 27, 2017 ",1
威胁巴厘岛的火山使游客的计划陷入危险之中,"印度尼西亚巴厘岛（路透社）——在印尼最高火山随时可能喷发的情况下，一些游客对访问这个热带岛屿产生了疑虑。半个世纪前，该火山的喷发造成了超过1000人死亡。地下的强烈火山震动和从风景如画的阿贡山上冒出的白色烟雾引起了人们的恐慌，导致超过75000人被疏散到距离火山12公里（7.5英里）以外的地方。

印度尼西亚位于所谓的“环太平洋火山带”上，拥有近130座活火山，比任何其他国家都多。许多印尼居民居住在火山附近，因为熔岩流使周围的土壤变得肥沃，适合耕种。

包括澳大利亚、新加坡和美国在内的几个国家已经发布了旅游咨询，提醒度假者注意新的风险。巴厘岛的酒店运营商表示，有关火山的新闻导致了预订取消的情况。

自从阿贡山警戒级别提升至最高级别以来，生意就变得清淡了，巴厘岛著名的旅游区达萨万纳度假村经理Ketut Purnawata说道。去年有将近500万人造访巴厘岛——其中大部分来自澳大利亚、中国和日本。澳大利亚和新加坡的航空公司表示他们正在准备应对可能的航班中断，但目前航班运行正常。飞往巴厘岛的维珍澳大利亚航空和捷星航空均表示，如果需要改变航线，他们将携带额外的燃油。捷星航空和总部设在新加坡的低成本航空公司斯库特表示，他们接到了少数客户更改旅行日期的要求。斯库特的一位女发言人称，不到100名顾客选择改期。新加坡航空及其短途子公司胜安航空表示，10月2日之前前往巴厘岛的旅客可以重新预订或要求退款，而亚航则表示航班正常运行。一家印尼旅行社表示，他们看到了一些取消订单的情况。“肯定会对（销售）旅游套餐产生影响，但我们还不知道具体数字。”PT Bayu Buana旅行社的Agustinus Pake Seko说道。

总统佐科·维多多于周二参观了阿贡山附近的避难所，并敦促居民遵循疏散程序。据报道，有些人不愿意离开家园，因为他们认为没有发生什么大事。政府将继续努力减轻社区的经济损失，但最重要的是确保这里人民的安全，维多多告诉记者。“因此我呼吁所有住在阿贡山周围的人听从官员们的指示，尽量减少这次火山爆发的影响。”

这座以海滩、寺庙和温和的印度教文化闻名的岛屿大体上生活照常进行。一位名叫Jordi Portalo的23岁的西班牙游客说：“我认为这种情况可能会发生……也许我们得再待几天，所以没什么好担心的。”他坐在努沙杜瓦标志性的白色冲浪海滩旁的一家咖啡馆里。阿贡山上次喷发是在1963年，当时旅游业尚未兴起，熔岩流沿着山坡流淌了大约7公里远，杀害了超过1000名村民。最近几次火山喷发出的火山灰云也扰乱了巴厘岛和其他地区的旅游业。2016年，当巴厘岛邻近的龙目岛上的火山喷发时，数百架国内和国际航班被迫中断，大量的火山灰和碎片升入空中。",worldnews,"September 26, 2017 ",1
"普京赞扬俄罗斯销毁化学武器，指责美国

请注意，由于您提供的句子不完整，我无法确定“accuses U.S.”的具体含义。如果您能提供更多的上下文信息，我可以为您提供更准确的翻译。",莫斯科（路透社）- 总统弗拉基米尔·普京周三表示，俄罗斯提前三年完成了最后一批化学武器的销毁工作，称这是一件具有历史意义的事件。在俄罗斯24电视台播出的电视讲话中，普京还抱怨美国没有履行自己销毁化学武器的义务，并指出美国三次推迟这一行动，理由是缺乏资金。,worldnews,"September 27, 2017 ",1
“大问题”是罗兴亚人能否回家：联合国难民事务高级专员,日内瓦（路透社）——联合国难民事务高级专员菲利波·格兰迪周三表示，关于在孟加拉国多达80万罗兴亚难民的“大问题”是他们是否会被允许返回家园。格兰迪说，他希望下周能在日内瓦与缅甸官员讨论罗兴亚人的无国籍问题，但承认这是一个“非常复杂的问题”。格兰迪在从孟加拉国回到日内瓦后举行的新闻发布会上说：“很明显，这场危机的原因在于缅甸，但解决这一危机的方法也在于缅甸。”他呼吁缅甸当局结束若开邦北部地区的暴力行为，以便能够就局势进行讨论。自8月25日以来，约48万名罗兴亚人逃离了若开邦北部，并指控军方发动了一场由罗兴亚武装分子袭击警察哨所引发的暴力行动。大约30万名罗兴亚人此前已越过邻国孟加拉国边境。据周三报道，一位缅甸部长称，仰光政府将负责管理在若开邦发生的暴力事件中焚毁村庄的重建工作。格兰迪说：“由于如果暴力停止，返回可能需要时间，因此，我认为有必要在中期找到适合在孟加拉国的那些人的解决方案。”他呼吁缅甸政府实施前联合国秘书长科菲·安南领导的委员会的建议。“罗兴亚人缺乏公民身份，这需要得到解决，”他说。“显然，只有持有证件的人才能回去，那将是极少数人甚至没有，所以我认为这项运动应该超越这一点，真正确定谁是国家公民，这些人应该被允许回去并获得公民身份。”格兰迪谴责罗兴亚武装分子的暴力行为，警告说：“我在访问若开邦北部时也非常明显地看到，这种情况下的歧视和贫困只会导致恐怖分子涌现，而且这种情况不会持续太久。”他说：“如果情况得不到解决，整个地区——这是一个特别脆弱的地区——出现恐怖主义暴力的风险非常高。”,worldnews,"September 27, 2017 ",1
"以下是图片中的英文内容的翻译：

缅甸冲突残酷性的证明：被屠杀的印度教徒

请注意，由于图片中未显示具体的内容，因此无法进行准确的翻译。如果您能提供更多的上下文或详细信息，我会尽力帮助您完成翻译任务。",缅甸（雅瓦卡），缅甸当局周三展示了他们称是穆斯林叛乱分子杀害的印度教村民尸体，这些受害者现在正在参与一场宣传战。本周，当局在实皆省北部发现45名印度教村民被埋葬在大批坟墓中，这一消息主导了缅甸媒体对新一轮暴力事件的报道，这场暴力事件发生在该省佛教徒和穆斯林之间的旧冲突之中。周三，军方派一群记者从仰光飞往现场，看到尸体被摆放在草地上，并听取了发现尸体的警察的话。信息关于大屠杀的消息从寻求庇护于孟加拉国的印度教难民那里传回后，警方根据对方提供的线索追踪到了这里。 “我们根据另一边的信息找到了路径，”警察奥卡尔·科告诉现场的记者。“我们发现土壤不正常，然后当我们挖开地面时，就闻到一股气味。” 实皆省的最新暴力事件于8月25日爆发，当时罗兴亚穆斯林叛乱分子袭击了30个警局和一个军营，造成约12人丧生。数小时后，阿腊肯罗兴亚拯救军队（ARSA）叛乱分子来到印度教村庄耶巴卡，聚集了大约100人，穿过他们的田地，用刀将他们杀死，政府说。对叛乱分子的军事反应迫使48万名罗兴亚难民逃往孟加拉国，并招致联合国指责军方与佛教激进分子一起进行种族清洗。 缅甸否认这一点，称其部队在与残忍的恐怖分子作战。对于政府来说，证据就在耶巴卡村外的大批坟墓旁，一目了然。 社会福利、救济和安置部长温迈艾（Win Myat Aye）周二参观了现场，他对路透社说：“这是恐怖主义。” ARSA否认杀死了印度教徒，表示他们从不杀害平民。 缅甸小众印度教群体为何卷入血腥事件的原因尚不清楚，不同的人在不同时间给出了不同的说法。一些村民说，叛乱分子怀疑印度教徒站在政府的立场，充当政府的间谍。 八月底，路透社记者在孟加拉国采访了一群来自这个村的印度教妇女，她们说她们的男性亲人被阿拉金佛教徒杀害。然而，这三名妇女本周向路透社透露，把她们带到孟加拉国的穆斯林曾命令她们说凶手是佛教激进分子。这三位分别讲述着几乎相同故事的妇女说，8月25日，她和另外大约100名印度教徒被蒙面男子带到一个大规模坟墓附近。后来，她们能够认出其中一些蒙面人是罗兴亚穆斯林，尽管这些妇女说，除了当地穆斯林和印度教都使用的方言之外，这些男人还讲了几种她们无法辨认的语言。 “我们看着他们把每个人的双手和双腿绑起来……他们割断了所有人的喉咙，并将他们推入一个洞里，”一位名叫比纳·巴拉（Bina Bala）的22岁妇女说，她补充说，在承诺改信伊斯兰教后，女性们得以幸免。 她们说，攻击者反对官方身份证明文件只发给印度教徒而不发给穆斯林，说印度教徒不应该有这些证件。 受害者被蒙住眼睛，双手被绑住，喉管被割断，缅北芒代市医院院长凯茂明敏通说。 “证据指向了ARSA恐怖分子犯下的屠杀，”他告诉国家控制的《新光芒》报纸。指控满天飞，而尸体等待火化。 警察一直在守卫大规模坟墓的地点，夜间点火以防止野狗靠近。,worldnews,"September 27, 2017 ",1
联合国对伊拉克的大规模绞刑感到震惊，担心可能会有更多类似事件发生,"日内瓦（路透社）——联合国人权事务高级专员泽德·拉阿德·阿尔胡森周三表示，他震惊地得知伊拉克周日处决了42名男子，几乎可以肯定他们没有得到公正审判，他还担心会有更多类似事件发生。被处决的囚犯被指控犯有各种恐怖主义罪行，包括杀害安全部队成员和引爆汽车炸弹。泽德在一份声明中说：“听说一天之内有42名囚犯被处决，我感到震惊。”我们非常关注有关伊拉克可能加速执行已经判决死刑的囚犯进程的报告，这可能在未来几周内导致更多的大规模处决。泽德说，对于这42个个人案例中的每一个，都很难相信严格的法律程序和公平审判保障得到了满足，包括这些男子的有效法律援助权、完整的上诉程序以及寻求宽恕或减刑的权利。绞刑发生在9月14日，当天逊尼派自杀袭击者在纳西里耶以南的一个什叶派地区造成至少60人丧生，引发了什叶派要求采取更严厉司法行动的要求。声明称，伊拉克官员表示，在纳西里耶大约6000名囚犯中约有1200人已被判处死刑。泽德说，伊拉克使用死刑引起了“巨大担忧”，并呼吁政府立即暂停其使用。他说，被证明犯下严重罪行的恐怖组织成员应受到完全的追究责任。然而，伊拉克使用反恐法对一系列行为实施死刑似乎不符合最严重的犯罪标准。声明中没有透露那些周日被处决的人的信息，如他们的姓名、居住地、罪行、审判日期或定罪日期。声明称，伊拉克官员表示所有上诉程序都已用尽。

",worldnews,"September 27, 2017 ",1
